Phrase_a_traduire,Phrase_traduite,Sortie_modele
 <start> i get the feeling you don t really want me to go . <end>, <start> j ai le sentiment que vous ne voulez pas vraiment que je parte . <end>,j ai le sentiment que vous ne voulez pas vraiment que je y aille . 
 <start> i can think of some situations in which a knife would come in handy . <end>, <start> je peux imaginer des situations dans lesquelles un couteau serait bien utile . <end>,je peux imaginer de nombreux situations dans lesquelles un couteau digne de couteau . 
 <start> it s a tremendous deal . <end>, <start> c est un contrat enorme . <end>,c est un contrat de tete . 
 <start> the girl was trembling with fear . <end>, <start> la fille tremblait de peur . <end>,la fille tremblait de peur . 
 <start> i didn t see you come in . <end>, <start> je ne vous ai pas vue entrer . <end>,je ne vous ai pas vus entrer . 
 <start> i m glad that makes you happy . <end>, <start> je suis contente que ca vous rende heureuse . <end>,je suis content que ca te rende heureux . 
 <start> he s spending too much time on the computer . <end>, <start> il passe trop de temps a l ordinateur . <end>,il passe trop de temps a l ordinateur . 
" <start> come on , let s try it . <end>"," <start> allez , tentons le ! <end>","allez , essayons ! "
 <start> i can t believe you think i m pushy . <end>, <start> je n arrive pas a croire que tu penses que je sois insistant . <end>,je n arrive pas a croire que vous pensiez que je sois insistant . 
 <start> the mother and daughter represented two generations . <end>, <start> la mere et la fille ont represente deux generations . <end>,la mere et l equipe de facon drastique deux generations . 
" <start> she advised him to go to the hospital , but he didn t follow her advice . <end>"," <start> elle lui a conseille d aller a l hopital , mais il n a pas suivi son conseil . <end>","elle lui recommanda d aller a l hopital , mais il n a pas suivi son conseil . "
 <start> she is my daughter . <end>, <start> c est ma fille . <end>,elle est ma fille . 
 <start> are you sure you don t want to come tonight ? <end>, <start> etes vous sures de ne pas vouloir venir ce soir ? <end>,es tu sure de ne pas vouloir venir ce soir ? 
 <start> it s the ultimate test . <end>, <start> c est l examen ultime . <end>,c est l examen ultime . 
 <start> can i have the paper when you re finished with it ? <end>, <start> puis je avoir le journal une fois que tu en auras termine ? <end>,puis je avoir le journal quand tu auras termine ? 
 <start> did you have a pleasant trip ? <end>, <start> as tu passe un agreable voyage ? <end>,avez vous passe un agreable voyage ? 
 <start> i would never let you down . <end>, <start> je ne vous laisserais jamais tomber . <end>,je ne vous laisserai jamais tomber . 
 <start> i m sorry if i frightened you . <end>, <start> je suis desolee si je t ai effrayee . <end>,je suis desole si je vous ai effrayees . 
 <start> i ll teach you everything you need to know . <end>, <start> je t enseignerai tout ce que tu as besoin de savoir . <end>,je vous apprendrai tout ce dont vous avez besoin de savoir . 
 <start> he fell in love with his best friend . <end>, <start> il est tombe amoureux de sa meilleure amie . <end>,il est tombe amoureux de son meilleur ami . 
 <start> i heard a knock at the door . <end>, <start> j ai entendu frapper a la porte . <end>,j ai entendu frapper a la porte . 
 <start> i m from singapore . <end>, <start> je suis de singapour . <end>,je suis de singapour . 
" <start> if i knew it , i would tell you . <end>"," <start> si je le savais , je le dirais . <end>","si je le savais , je te le dirais . "
 <start> what s your opinion on this ? <end>, <start> quelle est votre opinion a ce propos ? <end>,quelle est votre opinion sur ca ? 
 <start> can we help ? <end>, <start> pouvons nous donner un coup de main ? <end>,pouvons nous donner un coup ? 
 <start> can we go ? <end>, <start> pouvons nous partir ? <end>,pouvons nous y aller ? 
 <start> his grandfather bought him the expensive toy . <end>, <start> son grand pere lui a achete le jouet couteux . <end>,son grand pere lui a achete le jouet couteux . 
 <start> get in the car now . <end>," <start> grimpez dans la voiture , maintenant ! <end>","monte dans la voiture , maintenant ! "
 <start> is this building open to the public ? <end>, <start> ce batiment est il ouvert au public ? <end>,est ce que ce batiment est ouvert au public ? 
 <start> the influence of tv on society is great . <end>, <start> l influence de la tv sur la societe est grande . <end>,l influence de la tv sur la societe est grande . 
 <start> she was always practicing the piano . <end>, <start> elle pratiquait toujours le piano . <end>,elle pratiquait toujours le piano . 
 <start> she would often play tricks on me . <end>, <start> elle me joue souvent des tours . <end>,elle me joue souvent des tours . 
 <start> he doesn t want to get out of bed . <end>, <start> il ne veut pas sortir du lit . <end>,il ne veut pas sortir du lit . 
 <start> you are important . <end>, <start> vous etes importantes . <end>,tu es importante . 
 <start> he left for new york a week ago . <end>, <start> il est parti pour new york il y a une semaine . <end>,il est parti pour new york il y a une semaine . 
 <start> the weather is terrible today . <end>, <start> il fait degueulasse aujourd hui . <end>,il fait horriblement aujourd hui . 
 <start> how can you be so sure ? <end>, <start> comment pouvez vous en etre tellement sure ? <end>,comment pouvez vous etre si sures ? 
 <start> i know tom was distracted . <end>, <start> je sais que tom etait distrait . <end>,je sais que tom etait distrait . 
 <start> there s nobody home . <end>, <start> il n y a personne chez nous . <end>,il n y a personne chez moi . 
 <start> nobody does it better . <end>, <start> personne ne le fait mieux . <end>,personne ne fait mieux . 
 <start> he had a problem with the front door key . <end>, <start> il a eu un probleme avec la cle de la porte d entree . <end>,il a eu un probleme a la jambe d entree . 
 <start> we often hear about an energy crisis these days . <end>," <start> nous entendons souvent parler d une crise de l energie , de nos jours . <end>",on entend souvent par une crise de l une crise nos jours . 
 <start> he s always at home on sundays . <end>, <start> il est toujours chez lui le dimanche . <end>,il est toujours chez lui le dimanche . 
 <start> he s not supposed to be here . <end>, <start> il n est pas suppose se trouver la . <end>,il n est pas cense etre ici . 
 <start> i haven t been sleeping very much lately . <end>," <start> je n ai pas beaucoup dormi , ces derniers temps . <end>","je n ai pas beaucoup dormi , ces derniers temps . "
 <start> we all have kids . <end>, <start> nous avons toutes des gosses . <end>,nous avons toutes des gosses . 
 <start> i mistook her for minako . they look so much alike . <end>, <start> je l ai prise pour minako . elles se ressemblent tellement . <end>,je l ai prise pour minako . elles se ressemblent tellement . 
 <start> she talked on and on about her family problems . <end>, <start> elle parlait encore et encore de ses problemes familiaux . <end>,elle parlait avec lui et encore de ses problemes familiaux . 
 <start> i want you to tell me the truth . <end>, <start> je voudrais que tu me dises la verite . <end>,je veux que tu me dises la verite . 
 <start> your shirt is inside out . <end>, <start> votre chemise est a l envers . <end>,ta chemise est a l envers . 
 <start> unusually warm weather caused problems for the apple harvest . <end>, <start> le temps anormalement chaud engendre des problemes pour la recolte de pommes . <end>,le anormalement anormalement chaud engendre des problemes pour la recolte de pommes . 
 <start> don t take this the wrong way . <end>, <start> ne prends pas ca de travers ! <end>,ne prends pas ca de travers ! 
 <start> they all scoffed . <end>, <start> ils ont tous raille . <end>,ils ont tous raille . 
 <start> i have to do what s right . <end>, <start> il me faut faire ce qui est juste . <end>,il me faut faire ce qui est juste . 
 <start> your letter made me happy . <end>, <start> ta lettre m a rendue heureuse . <end>,votre lettre m a rendue heureuse . 
 <start> let me help you . <end>, <start> laissez moi vous aider . <end>,laissez moi vous aider . 
 <start> it s too far away . <end>, <start> c est trop loin . <end>,c est trop loin . 
 <start> i really want to get this work done . <end>, <start> je veux vraiment que ce travail soit fait . <end>,je veux vraiment que ce travail soit fait . 
 <start> he is a scientist . <end>, <start> c est un scientifique . <end>,c est un scientifique . 
 <start> i wonder if you have ever considered going to a specialist . <end>, <start> je me demande si tu n as jamais considere te rendre chez un specialiste . <end>,je me demande si tu n es jamais alle a un specialiste . 
 <start> she was ashamed of her children s behavior . <end>, <start> elle avait honte du comportement de ses enfants . <end>,elle avait honte de ce comportement de ses enfants . 
 <start> please answer the phone . <end>, <start> reponds au telephone s il te plait . <end>,reponds au telephone s il te plait . 
 <start> that should be enough for you . <end>, <start> cela devrait etre suffisant pour toi . <end>,cela devrait suffire pour toi . 
" <start> they say that in america anyone can become president , but perhaps that s not really true . <end>"," <start> on dit qu aux etats unis d amerique , n importe qui peut devenir president , mais ce n est peut etre pas reellement vrai . <end>","ils disent qu aux etats unis peut devenir president , mais ce n peut pas etre vrai . "
 <start> i don t like mussels . <end>, <start> je n aime pas les moules . <end>,je n aime pas les moules . 
 <start> he was at work till late at night . <end>, <start> il etait au travail jusque tard la nuit . <end>,il etait au travail a jusque tard la nuit . 
 <start> what do you call this bird in english ? <end>, <start> comment appelle t on cet oiseau en anglais ? <end>,comment nomme t on cet oiseau en anglais ? 
 <start> we can t waste even a minute . <end>, <start> nous ne pouvons pas perdre ne serait ce qu une minute . <end>,nous ne pouvons pas perdre une minute . 
 <start> please give me a cup of tea . <end>, <start> donne moi une tasse de the s il te plait . <end>,donne moi une tasse de the s il te plait . 
 <start> tom seems nice . <end>, <start> tom a l air gentil . <end>,tom a l air gentil . 
 <start> tom doesn t like living alone . <end>, <start> tom n aime pas vivre seul . <end>,tom n aime pas vivre seul . 
 <start> i didn t know you were that good at french . <end>, <start> j ignorais que tu etais aussi bonne en francais . <end>,je ne savais pas que tu etais aussi bon en francais . 
 <start> i found it difficult to read the book . <end>, <start> j ai trouve ce livre difficile a lire . <end>,je trouvai difficile a lire le livre . 
 <start> he fumbled with the keys before finding the right one . <end>, <start> il farfouilla les cles avant de trouver la bonne . <end>,il implora les chiens avant de trouver l un seul . 
 <start> i insist that we leave immediately . <end>, <start> j insiste pour que nous partions sur le champ . <end>,j insiste pour que nous partions sur le champ . 
 <start> don t confuse desire with love . <end>, <start> ne confonds pas le desir avec l amour . <end>,ne confonds pas le desir avec l amour . 
 <start> you are too late . <end>, <start> vous arrivez trop tard . <end>,tu es trop tard . 
 <start> they tried to cheer me up . <end>, <start> ils essayerent de me remonter le moral . <end>,ils essayerent de me remonter . 
 <start> my family will be away for a week . <end>, <start> ma famille sera au loin pour une semaine . <end>,ma famille sera en deplacement pour une semaine . 
 <start> i want to talk to your manager . <end>, <start> je veux parler a ton gerant . <end>,je veux parler a votre gerant . 
 <start> how about going on a picnic ? <end>, <start> et si on allait pique niquer ? <end>,et si nous y allions pique niquer ? 
 <start> i really think you should come . <end>, <start> je pense vraiment que tu devrais venir . <end>,je pense vraiment que vous devriez venir . 
 <start> you must work hard to succeed . <end>, <start> vous devez travailler dur pour reussir . <end>,vous devez travailler dur pour reussir . 
 <start> can you forgive me ? <end>, <start> pouvez vous me pardonner ? <end>,peux tu me pardonner ? 
 <start> i thought i was happy . <end>, <start> je pensais etre heureuse . <end>,je pensais etre heureux . 
 <start> spain will need to borrow billion euros . <end>, <start> l espagne devra emprunter cent milliards d euros . <end>,l espagne devra emprunter cent milliards d euros . 
 <start> is it possible to determine the diameter from the circumference ? <end>, <start> est il possible d inferer le diametre a partir de la circonference ? <end>,est il possible d inferer le diametre a partir de la circonference ? 
 <start> you must go to school . <end>, <start> tu dois aller a l ecole . <end>,tu dois aller a l ecole . 
 <start> tom doesn t look rich to me . <end>, <start> tom n a pas l air riche pour moi . <end>,tom n est pas riche pour moi . 
 <start> that s what i want to do . <end>, <start> c est ce que je veux faire . <end>,c est ce que je veux faire . 
 <start> you have reached your destination . <end>, <start> tu as atteint ta destination . <end>,tu as atteint ta destination . 
 <start> i recognized her at first sight . <end>, <start> je la reconnus du premier coup d il . <end>,je l ai reconnue en premier regard . 
 <start> yesterday i helped my father . <end>," <start> hier , j ai aide mon pere . <end>","hier , j ai aide mon pere . "
 <start> do you want to see her very much ? <end>, <start> tu as vraiment tres envie de la voir ? <end>,voulez vous vraiment la voir ? 
 <start> we ought to do better . <end>, <start> nous devrions mieux faire . <end>,nous devrions faire mieux . 
 <start> tom called me fat . <end>, <start> tom m a decrit comme gros . <end>,tom m a appele gros . 
 <start> tom ran as fast as he was able to . <end>, <start> tom a couru aussi vite qu il a pu . <end>,tom a couru aussi vite qu il a pu . 
 <start> what time is it by your watch ? <end>, <start> quelle heure est il a votre montre ? <end>,quelle heure est votre montre ? 
 <start> let someone else handle it . <end>, <start> laissez quelqu un d autre s en charger ! <end>,laissez quelqu un d autre s en charger ! 
 <start> i m buying . <end>, <start> c est moi qui paie . <end>,je suis en train d acheter . 
 <start> tom leaned on the counter . <end>, <start> tom se pencha sur le comptoir . <end>,tom se pencha sur le comptoir . 
 <start> neither of his students passed the exam . <end>, <start> aucun de ses etudiants n a reussi l examen . <end>,aucun de ses eleves est mort l examen . 
 <start> it looks like she s got a lot of friends . <end>, <start> elle semble avoir beaucoup d amis . <end>,elle semble avoir beaucoup d amies . 
 <start> he is a promising young businessman . <end>, <start> c est un jeune homme d affaires prometteur . <end>,c est un jeune homme prometteur . 
 <start> i live miles away from the nearest station . <end>, <start> j habite a des kilometres de la gare la plus proche . <end>,je vis des kilometres de la gare la plus proche . 
 <start> i got lucky . <end>, <start> j ai eu de la chance . <end>,j ai eu de la chance . 
 <start> you re callous . <end>, <start> tu es insensible . <end>,tu es insensible . 
" <start> we drove through village after village , until we got to our destination . <end>", <start> nous traversames village apres village jusqu a ce que nous atteignimes notre destination . <end>,nous traversames village apres village apres village jusqu a notre destination . 
 <start> when did you plant these trees ? <end>, <start> quand as tu plante ces arbres ? <end>,quand avez vous plante ces arbres ? 
 <start> i just want your love . <end>, <start> je veux juste votre amour . <end>,je veux juste votre amour . 
 <start> i played tennis after school . <end>, <start> je jouais au tennis apres l ecole . <end>,j ai joue au tennis apres l ecole . 
 <start> i apologize for not writing to you before . <end>, <start> veuillez m excuser de ne pas vous avoir ecrit avant . <end>,je vous presente mes excuses pour ne pas vous avoir ecrit avant . 
 <start> did you go straight home after school yesterday ? <end>," <start> etes vous directement rentres chez vous hier , apres l ecole ? <end>","etes vous directement rentre chez vous hier , apres l ecole ? "
 <start> i telephoned her at once . <end>, <start> je lui ai immediatement telephone . <end>,je lui telephonai immediatement . 
 <start> how do you plan to help me ? <end>, <start> comment prevoyez vous de m aider ? <end>,comment prevois tu de m aider ? 
 <start> why are you angry ? i m not angry ! <end>, <start> pourquoi es tu en colere ? je ne suis pas en colere ! <end>,pourquoi etes vous en colere ? je ne suis pas en colere ! 
 <start> i m having a hard time with french grammar . <end>, <start> j ai du mal avec la grammaire francaise . <end>,j ai du mal avec la grammaire francaise . 
 <start> she never thinks about him . <end>, <start> elle ne pense jamais a lui . <end>,elle ne pense jamais a lui . 
 <start> spring is just around the corner . <end>, <start> le printemps est bientot la . <end>,le printemps est seulement aux alentours . 
" <start> hurry up , and you ll catch the bus . <end>", <start> si tu te depeches tu attraperas le bus . <end>,depeche toi et tu attraperas le bus . 
 <start> i have a burning pain here . <end>, <start> j ai ici une vive douleur . <end>,j ai une vive douleur ici . 
 <start> let me tell you something about myself . <end>, <start> laisse moi te dire quelque chose a mon sujet . <end>,laissez moi vous dire quelque chose a moi meme . 
 <start> the book is red . <end>, <start> le livre est rouge . <end>,le livre est rouge . 
 <start> this will be a good souvenir of my trip around the united states . <end>, <start> ca sera un bon souvenir de mon voyage a travers les etats unis . <end>,cela fera mon voyage dans les etats unis d amerique . 
 <start> could you send it by email ? <end>, <start> pouvez vous l envoyer par courrier electronique ? <end>,pourriez vous l envoyer par courriel ? 
 <start> the two of them were never to meet again . <end>, <start> toutes deux ne devaient jamais plus se rencontrer . <end>,les deux ne devaient jamais discuter . 
 <start> we ll never forget your kindness . <end>, <start> nous n oublierons pas ta gentillesse . <end>,nous n oublierons pas ta gentillesse . 
" <start> you are tired , and so am i . <end>"," <start> tu es fatigue , et moi aussi . <end>","tu es fatigue , et moi aussi . "
 <start> i can t tell you where tom lives . <end>, <start> je ne peux pas vous dire ou tom vit . <end>,je ne peux pas te dire ou tom vit . 
 <start> i don t think i can eat this . <end>, <start> je ne pense pas parvenir a manger ca . <end>,je ne pense pas pouvoir manger ca . 
 <start> they re barely paid minimum wage . <end>, <start> ils sont a peine payes le smic . <end>,ils ont a peine touche au salaire minimum . 
 <start> what should i do ? i said to myself . <end>, <start> que devrais je faire ? me dis je . <end>,que devrais je faire ? me dis je . 
 <start> tom didn t have to do this . <end>, <start> tom n avait pas a faire ceci . <end>,tom n avait pas a faire ca . 
 <start> a lot of people are dealing with hay fever now . <end>," <start> de nombreuses personnes ont des problemes de rhume des foins , actuellement . <end>","beaucoup de gens ont affaire de rhume des foins , actuellement . "
 <start> i should tell tom i m tired . <end>, <start> je devrais dire a tom que je suis fatigue . <end>,je devrais dire a tom que je suis fatiguee . 
 <start> i ve always wanted to meet you . <end>, <start> j ai toujours voulu faire votre connaissance . <end>,j ai toujours voulu te rencontrer . 
 <start> she was advised by him to give up drinking . <end>, <start> il lui conseilla d arreter de boire . <end>,il lui a conseille d arreter de boire . 
 <start> casualties were inevitable . <end>, <start> les victimes furent inevitables . <end>,les victimes furent inevitables . 
 <start> you can t just walk in here . <end>, <start> vous ne pouvez simplement pas penetrer ici . <end>,tu ne peux pas entrer ici . 
 <start> i am no longer a child . <end>, <start> je ne suis plus un enfant . <end>,je ne suis plus un enfant . 
 <start> i did do some checking . <end>, <start> j ai procede a quelques verifications . <end>,j ai fait de refus . 
 <start> tom was delirious . <end>, <start> tom delirait . <end>,tom delirait . 
 <start> i wonder why . <end>, <start> je me demande pourquoi . <end>,je me demande pourquoi . 
 <start> where would you like to sit ? <end>, <start> ou desirez vous vous asseoir ? <end>,ou aimerais tu t asseoir ? 
 <start> he s not such a great writer and i think he knows it . <end>, <start> il n est pas un tres bon ecrivain et je pense qu il le sait . <end>,ce n est pas un vrai garcon et je pense qu il le sait . 
 <start> i gave it my best shot . <end>, <start> j ai fait de mon mieux . <end>,j ai fait de mon mieux . 
 <start> that s simple . <end>, <start> c est simple . <end>,c est simple . 
 <start> you can t know that for sure . <end>, <start> tu ne peux pas en etre certaine . <end>,tu ne peux pas en etre certaine . 
 <start> you look happy . <end>, <start> tu as l air heureuse . <end>,tu as l air heureux . 
 <start> tom is extremely busy now . <end>, <start> tom est extremement occupe en ce moment . <end>,tom est extremement occupe en ce moment . 
 <start> we drank a lot of coffee . <end>, <start> nous avons bu beaucoup de cafe . <end>,nous avons bu du cafe . 
 <start> the population of china is about eight times as large as that of japan . <end>, <start> la population de la chine est environ huit fois plus importante que celle du japon . <end>,la population de la chine est environ huit fois plus grande que celle du japon . 
 <start> tom won t let you win again . <end>, <start> tom ne va pas te laisser gagner de nouveau . <end>,tom ne vous laissera pas gagner a nouveau . 
 <start> how many times do you think you ve eaten here ? <end>, <start> combien de fois penses tu avoir mange ici ? <end>,combien de fois penses tu avoir mange ici ? 
 <start> are you on holiday ? <end>, <start> etes vous en vacances ? <end>,etes vous en vacances ? 
 <start> i believe in getting up early . <end>, <start> je crois a la vertu de se lever tot . <end>,je crois en lever tot . 
 <start> i like wild flowers . <end>, <start> j aime les fleurs des champs . <end>,j aime les champs des champs . 
 <start> excuse me for one moment . <end>," <start> excusez moi , un instant . <end>",excusez moi un moment ! 
 <start> i would never consider building a house in this area . <end>, <start> jamais je n envisagerais de construire une maison dans ce coin . <end>,je n envisagerais de construire une maison dans ce coin . 
 <start> i don t want to stop . <end>, <start> je ne veux pas m arreter . <end>,je ne veux pas m arreter . 
 <start> an electric current can generate magnetism . <end>, <start> un courant electrique peut generer du magnetisme . <end>,un courant electrique peut generer du magnetisme . 
 <start> i think you have my umbrella . <end>, <start> je pense que tu as mon parapluie . <end>,je pense que tu as mon parapluie . 
 <start> should we tell everybody or not ? <end>, <start> devrions nous le dire a tout le monde ou non ? <end>,devrions nous le dire ou pas ? 
 <start> has something happened to tom ? <end>, <start> est ce que quelque chose est arrive a tom ? <end>,quelque chose est il arrive a tom ? 
 <start> can you keep a secret ? <end>, <start> pouvez vous garder un secret ? <end>,peux tu garder un secret ? 
 <start> i just got out of a relationship . <end>, <start> je viens de sortir d une relation . <end>,je viens de sortir d une relation . 
 <start> we all felt hungry . <end>, <start> nous avions tous faim . <end>,nous avons tous faim . 
 <start> he was unaware of the danger . <end>, <start> il etait inconscient du danger . <end>,il n etait pas conscient du danger . 
 <start> it s all mine . <end>, <start> tout est a moi . <end>,tout est a moi . 
 <start> i m at your service . <end>, <start> je suis a ton service . <end>,je suis a votre service . 
 <start> there is too much furniture in the house . <end>, <start> il y a trop de mobilier dans la maison . <end>,il y a trop de mobilier dans la maison . 
 <start> she makes him do his homework before dinner . <end>, <start> elle lui fait faire ses devoirs avant le souper . <end>,elle fait faire ses devoirs avant le diner . 
 <start> you re the reason i came . <end>, <start> c est pour toi que je suis venue . <end>,tu es la raison pour laquelle je suis venu . 
 <start> tom hates me . <end>, <start> tom me deteste . <end>,tom me deteste . 
 <start> who s volunteering ? <end>, <start> qui fait du benevolat ? <end>,qui se porte volontaire ? 
 <start> do you really want to lead this kind of life ? <end>, <start> voulez vous vraiment vivre ce genre de vie ? <end>,voulez vous vraiment rester ce genre de vie ? 
 <start> we cannot offer a further price reduction under the current circumstances . <end>, <start> nous ne pouvons conceder de reduction de prix supplementaire dans les conditions actuelles . <end>,nous ne pouvons conceder de prix supplementaire dans les conditions actuelles . 
 <start> make him work for it . <end>, <start> fais le travailler pour ! <end>,faites le travailler pour ca . 
 <start> i plan to go . i don t care if you do or not . <end>, <start> je prevois d y aller . ca m est egal que vous y alliez aussi ou pas . <end>,je prevois de m y rendre . je me fiche que tu y ailles ou pas . 
