Phrase_a_traduire,Phrase_traduite,Sortie_modele
 <start> these books belong to me . <end>, <start> ces livres sont a moi . <end>,ces livres sont faits . 
 <start> i had a problem to take care of . <end>, <start> il a fallu que je m occupe d un probleme . <end>,j ai eu un probleme a prendre soin . 
 <start> over people committed suicide . <end>, <start> plus de trente personnes se sont suicidees . <end>,plus de gens se sont suicidees . 
 <start> they hurried to the scene of the accident . <end>, <start> ils se precipiterent sur le lieu de l accident . <end>,ils se precipiterent sur le lieu de l accident . 
 <start> it s a huge responsibility . <end>, <start> c est une enorme responsabilite . <end>,c est une enorme responsabilite . 
 <start> would you mind turning down the radio ? <end>, <start> cela vous derangerait il de baisser la radio ? <end>,cela te derangerait il de baisser la radio ? 
 <start> tom is a lot shorter than mary . <end>, <start> tom est beaucoup plus petit que mary . <end>,tom est beaucoup plus court que mary . 
 <start> i ve got nothing more to say . <end>, <start> je n ai rien a ajouter . <end>,je n ai rien a ajouter . 
 <start> he won the prize last week . <end>, <start> il a gagne le prix la semaine derniere . <end>,il a gagne le prix la semaine derniere . 
 <start> can you try ? <end>, <start> pouvez vous essayer ? <end>,peux tu essayer ? 
 <start> my dog is wagging his tail . <end>, <start> mon chien remue la queue . <end>,mon chien est en tete de la queue . 
 <start> you ll break it if you re not careful . <end>, <start> tu vas le briser si tu ne fais pas attention . <end>,tu vas le briser si tu n es pas prudent . 
 <start> he took charge of the family business after his father died . <end>, <start> il prit en charge l affaire familiale apres que son pere mourut . <end>,il a pris le controle de la famille blanche au cours de son pere . 
 <start> you have been warned . <end>, <start> tu as ete prevenue . <end>,vous avez ete prevenu . 
 <start> you may stay here with me . <end>, <start> il se peut que tu restes ici avec moi . <end>,vous pouvez rester ici avec moi . 
 <start> i felt reborn . <end>, <start> je me suis sentie renaitre . <end>,je me suis sentie renaitre . 
 <start> my sister is bugging me . <end>, <start> ma s ur me casse les pieds . <end>,ma s ur m embete . 
 <start> it s not new . <end>, <start> ce n est pas nouveau . <end>,ce n est pas nouveau . 
 <start> i m not in love with you . <end>, <start> je ne suis pas amoureux de toi . <end>,je ne suis pas amoureuse de toi . 
" <start> do what you can , with what you have , where you are . <end>"," <start> fais ce que tu peux , avec ce que tu as , la ou tu es . <end>","fais ce que tu peux , avec ce que tu as , la ou tu es . "
 <start> she couldn t convince him to write a song for her . <end>, <start> elle ne put le convaincre d ecrire une chanson pour elle . <end>,elle ne put le convaincre d ecrire une chanson pour elle . 
 <start> tom was wondering how he was supposed to get around without a car . <end>, <start> tom se demandait comment il etait suppose se deplacer sans voiture . <end>,tom se demandait comment il etait cense se deplacer sans voiture . 
 <start> no one could solve the puzzle . <end>, <start> personne ne put resoudre l enigme . <end>,personne ne put resoudre le casse tete . 
 <start> they work in the fields . <end>, <start> ils travaillent aux champs . <end>,ils travaillent aux champs . 
 <start> he took me for my twin brother . <end>, <start> il m a pris pour mon frere jumeau . <end>,il m a pris pour mon frere jumeau . 
 <start> i just don t want to fight with you . <end>, <start> je ne veux tout simplement pas me disputer avec vous . <end>,je ne veux tout simplement pas me disputer avec toi . 
 <start> you should always tell the truth . <end>, <start> tu devrais toujours dire la verite . <end>,tu devrais toujours dire la verite . 
 <start> we can t help you . <end>, <start> nous ne pouvons pas vous aider . <end>,nous ne pouvons pas vous aider . 
 <start> i ran out of gas . <end>, <start> je tombai en panne d essence . <end>,je suis sorti de gaz . 
 <start> i know tom is groggy . <end>, <start> je sais que tom est sonne . <end>,je sais que tom est embrume . 
 <start> you ought to have seen it . <end>, <start> tu aurais du le voir . <end>,tu aurais du le voir . 
 <start> i don t know what s happening . <end>, <start> j ignore ce qui se produit . <end>,je ne sais pas ce qui se produit . 
 <start> would you be happier if i stayed ? <end>, <start> serais tu davantage contente si je restais ? <end>,serais tu davantage contente si je restais ? 
 <start> i know that i do not know . <end>, <start> je sais que je ne sais pas . <end>,je sais que je ne sais pas . 
 <start> what will they do to us ? <end>, <start> que nous feront ils ? <end>,que nous feront ils ? 
 <start> tom spends most of his time on the road . <end>, <start> tom passe la majeure partie de son temps sur la route . <end>,tom passe la majeure partie de son temps sur la route . 
 <start> we ve all done that . <end>, <start> nous avons tous fait ca . <end>,nous avons toutes fait cela . 
 <start> parents should monitor their children s whereabouts . <end>, <start> les parents devraient superviser les deplacements de leurs enfants . <end>,les parents devraient superviser les deplacements de leurs enfants . 
 <start> how are things coming along ? <end>, <start> comment avance la situation ? <end>,comment les choses se deroulent elles ? 
 <start> just use mine for now . <end>," <start> utilisez simplement le mien , pour le moment ! <end>",utilisez simplement le mien pour le moment ! 
 <start> never in my wildest dreams did i ever think that something like this would happen . <end>," <start> jamais , dans mes reves les plus fous , n ai je pense que quelque chose de tel surviendrait . <end>",dans mes reves les plus fous que n ai pense que quelque chose surviendrait . 
 <start> you seem to have a crush on tom . <end>, <start> vous semblez avoir un faible pour tom . <end>,vous semblez avoir un faible pour tom . 
 <start> i don t quite know how it happened . <end>, <start> je ne sais pas exactement comment ca s est produit . <end>,je ne sais pas exactement comment ca s est produit . 
 <start> there is an urgent need for new ideas . <end>, <start> on a un besoin urgent de nouvelles idees . <end>,il y a un besoin urgent de nouvelles idees . 
 <start> would you like to go ? <end>, <start> veux tu t en aller ? <end>,voudrais tu y aller ? 
 <start> is this fish still alive ? <end>, <start> est ce que ce poisson est encore vivant ? <end>,ce poisson est il encore vivant ? 
 <start> take this to your mother . <end>, <start> apporte ceci a ta mere . <end>,prenez ceci a votre mere ! 
 <start> he was ashamed of his tears . <end>, <start> il avait honte de ses larmes . <end>,il avait honte de ses larmes . 
 <start> his poems are difficult to understand . <end>, <start> ses poemes sont difficiles a comprendre . <end>,ses poemes sont difficiles a comprendre . 
 <start> i didn t pretend to be your friend . <end>, <start> je n ai pas pretendu etre ton ami . <end>,je n ai pas pretendu etre votre amie . 
 <start> it s a whole other ball game . <end>, <start> c est un jeu d un tout autre genre . <end>,c est un jeu d un tout nouveau droit . 
 <start> i m sure that i can do that . <end>, <start> je suis sure que je peux le faire . <end>,je suis sur de pouvoir le faire . 
" <start> if possible , i d like to know the name of the author . <end>"," <start> si c est possible , j aimerais connaitre le nom de l auteur . <end>","si c est possible , j aimerais connaitre le nom de l auteur . "
 <start> it was the greatest discovery in human history . <end>, <start> ce fut la plus grande decouverte de l histoire de l humanite . <end>,c etait la plus grande decouverte de l histoire . 
 <start> don t tell my girlfriend . <end>, <start> ne dites rien a ma petite amie ! <end>,ne dites rien a ma nana ! 
 <start> i can t stop sneezing . <end>, <start> je n arrive pas a m arreter d eternuer . <end>,je ne peux pas m arreter d eternuer . 
" <start> you re not upset , are you ? <end>"," <start> vous n etes pas contrarie , si ? <end>","tu n es pas contrarie , si ? "
 <start> go straight on down this street . <end>, <start> allez tout le long de cette rue . <end>,allez tout droit dans la rue . 
 <start> we love going on picnics . <end>, <start> nous adorons aller a des pique niques . <end>,nous aimons se debrouiller sur les cours . 
 <start> i d like to ask a few more questions . <end>, <start> j aimerais poser quelques questions supplementaires . <end>,j aimerais poser quelques questions additionnelles . 
 <start> i feel much better today . <end>, <start> je me sens beaucoup mieux aujourd hui . <end>,je me sens beaucoup mieux aujourd hui . 
 <start> that s it . i m outta here . <end>, <start> c est bon . je me casse . <end>,c est . je suis contre moi . 
 <start> his accent suggests he is a foreigner . <end>, <start> son accent laisse penser qu il est etranger . <end>,son accent laisse penser qu il est etranger . 
 <start> you re very rude . <end>, <start> vous etes fort grossieres . <end>,tu es fort grossiere . 
 <start> i was just about to call . <end>, <start> j etais sur le point d appeler le . <end>,j etais sur le point de appeler . 
 <start> who am i talking with ? <end>, <start> je parle avec qui ? <end>,avec qui parle t il ? 
 <start> i advised him to keep that promise . <end>, <start> je lui ai conseille de garder le secret . <end>,je lui ai conseille de garder cette promesse . 
 <start> we were very tired from the five hour trip . <end>, <start> nous etions tres fatiguees par le voyage de cinq heures . <end>,nous etions tres fatigues par le voyage heure . 
 <start> i can t come now . <end>, <start> je ne peux pas venir maintenant . <end>,je ne peux pas venir maintenant . 
 <start> my husband and i are both teachers . <end>, <start> mon mari et moi sommes tous les deux enseignants . <end>,mon mari et moi sommes tous deux enseignantes . 
 <start> they were punished for their crimes . <end>, <start> ils ont ete punis pour leurs crimes . <end>,elles ont ete punies pour leurs crimes . 
 <start> tom is the man of my dreams . <end>, <start> tom est l homme de mes reves . <end>,tom est l homme de mes reves . 
 <start> berries can be frozen . <end>, <start> les baies peuvent etre congelees . <end>,on peut etre gele . 
 <start> i can t believe he kissed you . <end>, <start> je n arrive pas a croire qu il vous ait embrassee . <end>,je n arrive pas a croire qu il t ait embrasse . 
 <start> can you call him ? <end>, <start> peux tu l appeler ? <end>,peux tu l appeler ? 
 <start> did i surprise you ? <end>, <start> t ai je surpris ? <end>,vous ai je surprise ? 
 <start> i don t want to be left holding the bag . <end>, <start> je n ai pas envie de me retrouver a porter le sac . <end>,je ne veux pas qu on me mette au sac . 
 <start> how did he come by this money ? <end>, <start> comment est il venu en possession de cet argent ? <end>,comment est il venu par cet argent ? 
 <start> those are mine . <end>, <start> ce sont les miens . <end>,ce sont les miennes . 
 <start> i thought about resigning from the company . <end>, <start> j ai songe a demissionner de l entreprise . <end>,j ai reflechi a demissionner de l entreprise . 
 <start> tom stole all of mary s money . <end>, <start> tom a vole tout l argent de mary . <end>,tom a vole tout l argent de mary . 
 <start> he just wants attention . <end>, <start> il veut juste attirer l attention . <end>,il veut juste attirer l attention . 
 <start> i don t think it was a mistake . <end>, <start> je ne pense pas que ce fut une erreur . <end>,je ne pense pas qu il s agissait d une erreur . 
 <start> tom is still at his grandfather s house . <end>, <start> tom est toujours chez son grand pere . <end>,tom est toujours a son grand pere . 
 <start> that s only a temporary solution . <end>, <start> c est juste une solution temporaire . <end>,ce n est qu une solution temporaire . 
 <start> never give up on your dreams . <end>, <start> ne laissez jamais tomber vos reves ! <end>,n abandonne jamais tes reves ! 
 <start> i gazed at the sea for hours . <end>, <start> j ai contemple la mer pendant des heures . <end>,j ai contemple la mer pendant des heures . 
 <start> who can blame you ? <end>, <start> qui peut te blamer ? <end>,qui peut te blamer ? 
 <start> go and wake mary up . <end>, <start> va reveiller marie . <end>,allez reveiller marie ! 
 <start> she steered our efforts in the right direction . <end>, <start> elle a dirige nos efforts dans la bonne direction . <end>,elle a dirige nos efforts dans la bonne direction . 
 <start> his obscene remarks will be expunged from the record . <end>, <start> ses remarques obscenes seront expurgees de l enregistrement . <end>,son remarques action sera sans place du resultat . 
 <start> they went their separate ways . <end>, <start> ils sont partis chacun de leur cote . <end>,ils sont alles chacun de leur cote . 
 <start> i think you know that s inappropriate . <end>, <start> je pense que tu sais que c est deplace . <end>,je pense que vous savez que c est inconvenant . 
 <start> i m sorry that i ve made you so unhappy . <end>, <start> je suis desolee de t avoir rendu si malheureux . <end>,je suis desolee d avoir fait si malheureux . 
 <start> can you prove it ? <end>, <start> peux tu le prouver ? <end>,peux tu le prouver ? 
 <start> it snowed . <end>, <start> il a neige . <end>,il a neige . 
 <start> aren t you hungry ? <end>, <start> n as tu pas faim ? <end>,n avez vous pas faim ? 
 <start> the job was really tough . <end>, <start> le boulot etait vraiment dur . <end>,le travail etait vraiment dur . 
 <start> we got separated . <end>, <start> nous avons ete separees . <end>,nous avons ete separees . 
 <start> i actually don t know . <end>," <start> en realite , je l ignore . <end>","en realite , je ne sais pas . "
 <start> i d like to say a few words . <end>, <start> j aimerais dire quelques mots . <end>,j aimerais dire quelques mots . 
 <start> i couldn t tell her from sister . <end>, <start> je ne pouvais la distinguer de sa s ur . <end>,je ne pouvais la distinguer de sa s ur . 
 <start> we have to crack down on illegal trading . <end>, <start> il faut sevir face au commerce illegal . <end>,nous devons abattre la cinquieme taxe . 
 <start> tom started singing . <end>, <start> tom a commence a chanter . <end>,tom se mit a chanter . 
 <start> we must water the flower . <end>, <start> nous devons arroser la fleur . <end>,nous devons arroser la pendule . 
 <start> i visited my father s grave . <end>, <start> je suis alle sur la tombe de mon pere . <end>,j ai visite la tombe de mon pere . 
 <start> i live in a rural area . <end>, <start> je vis dans une zone rurale . <end>,je vis dans une zone rurale . 
 <start> who would you like to speak to ? <end>, <start> avec qui aimeriez vous vous entretenir ? <end>,qui aimerais tu parler ? 
 <start> i remember giving tom some money . <end>, <start> je me souviens avoir donne de l argent a tom . <end>,je me souviens avoir donne de l argent a tom . 
 <start> you ve been warned . <end>, <start> on vous a prevenus . <end>,vous avez ete prevenu . 
 <start> don t call anybody . <end>, <start> n appelez personne ! <end>,n appelle personne ! 
 <start> do you smoke ? <end>, <start> est ce que tu fumes ? <end>,fumes tu ? 
" <start> i tried to solve the problem , but i couldn t . <end>"," <start> j ai essaye de resoudre ce probleme , mais je n ai pas pu . <end>",j ai essaye de resoudre le probleme mais je ne pus . 
 <start> are you willing to make a deal ? <end>, <start> etes vous decidee a faire affaire ? <end>,es tu decidee a faire affaire ? 
 <start> she went there last summer . <end>, <start> elle y est allee l ete dernier . <end>,elle y est allee l ete dernier . 
 <start> they let me go . <end>, <start> ils m ont laissee m en aller . <end>,ils m ont laisse m en aller . 
 <start> he didn t keep his word . <end>, <start> il n a pas tenu sa parole . <end>,il n a pas tenu sa parole . 
 <start> her red dress made her stand out . <end>, <start> sa robe rouge la distingua . <end>,sa robe rouge la distingua . 
 <start> trust me on that . <end>, <start> crois en moi ! <end>,croyez en moi ! 
 <start> don t count on it . <end>, <start> ne compte pas dessus . <end>,ne comptez pas sur ca . 
 <start> let me pay for it . <end>, <start> laisse moi le payer . <end>,laissez moi payer . 
 <start> we spent a lot of time with them . <end>, <start> nous avons passe beaucoup de temps avec eux . <end>,nous avons passe beaucoup de temps avec eux . 
 <start> it rained for hours and hours . <end>, <start> il a plu pendant des heures . <end>,il a plu pendant des heures . 
 <start> why don t you love me ? <end>, <start> et si tu m aimais ? <end>,pourquoi ne m aimes tu pas ? 
 <start> come into my arms . <end>, <start> viens dans mes bras . <end>,entre mes bras . 
 <start> what s your real name ? <end>, <start> quel est ton veritable nom ? <end>,quel est ton vrai nom ? 
 <start> did you have fun last night ? <end>, <start> vous etes vous amusees la nuit passee ? <end>,t es tu amuse la nuit passee ? 
" <start> wherever you go , you ll be welcomed . <end>"," <start> ou que vous alliez , vous serez bienvenues . <end>","ou que vous alliez , vous serez bienvenues . "
 <start> i like math best . <end>, <start> ce sont les maths que je prefere . <end>,j aime les maths . 
 <start> do you speak french ? <end>, <start> parlez vous francais ? <end>,parles tu francais ? 
 <start> i like your techno dance moves . <end>, <start> j aime tes mouvements de danse techno . <end>,j aime tes mouvements de danse techno . 
 <start> i wish my father had lived longer . <end>, <start> j aurais aime que mon pere vive plus longtemps . <end>,si seulement mon pere vit plus longtemps . 
 <start> she was kind enough to accompany me to the station . <end>, <start> elle a eu la gentillesse de m accompagner a la gare . <end>,elle fut assez gentille pour m y prendre a la gare . 
 <start> she spends her leisure time making dolls . <end>, <start> elle passe son temps de loisirs a faire des poupees . <end>,elle passe son temps de loisirs a faire des poupees . 
 <start> i just don t know what to do anymore . <end>, <start> je ne sais simplement plus quoi faire . <end>,je ne sais simplement plus quoi faire . 
 <start> he said it as a joke . <end>, <start> il le disait pour blaguer . <end>,il l a dit comme une blague . 
 <start> was it a hard decision ? <end>, <start> etait ce une decision difficile ? <end>,etait ce une decision difficile ? 
 <start> i don t want to handle it . <end>, <start> je ne veux pas m en charger . <end>,je ne veux pas le gerer . 
 <start> he did the best he could . <end>, <start> il fit du mieux qu il pouvait . <end>,il a fait de son mieux . 
 <start> he threw everything out of the boat . <end>, <start> il jeta tout hors du bateau . <end>,il jeta tout hors de bord du bateau . 
 <start> i have not seen him in months . <end>, <start> ca fait des mois que je ne l ai pas vu . <end>,je ne l ai pas vue depuis des mois . 
 <start> they are watching a movie . <end>, <start> ils regardent un film . <end>,ils regardent un film . 
 <start> you re surrounded . <end>, <start> vous etes cernees . <end>,tu es cernee . 
 <start> she hates fish and never eats any . <end>, <start> elle a horreur du poisson et n en mange jamais . <end>,elle a horreur du poisson et n en mange jamais . 
 <start> we just have to get out of here . <end>, <start> il nous suffit de sortir d ici . <end>,il nous faut juste sortir d ici . 
 <start> hold the box with both hands . <end>, <start> tiens la caisse des deux mains . <end>,tiens la caisse des deux mains . 
 <start> i m not against people owning guns . <end>, <start> je ne suis pas opposee a ce que les gens possedent des armes . <end>,je ne suis pas opposee a ce que les gens possedent des armes . 
 <start> are you vegetarian ? <end>, <start> es tu vegetarien ? <end>,etes vous vegetarienne ? 
 <start> i want this suit cleaned . <end>, <start> je voudrais faire nettoyer ce costume . <end>,je veux que ce costume soit montre . 
 <start> i hate goat cheese . <end>, <start> je deteste le fromage de chevre . <end>,je deteste le fromage de chevre . 
 <start> i ve tried . <end>, <start> j ai tente . <end>,j ai essaye . 
 <start> i know they ll all want to help you . <end>, <start> je sais qu ils voudront tous t aider . <end>,je sais qu ils voudront tous vous aider . 
 <start> you re the nicest girlfriend i ever had . <end>, <start> tu es la plus chouette petite amie que j ai jamais eue . <end>,tu es la plus chouette amie que j ai jamais eue . 
 <start> does he have a dog ? <end>, <start> a t il un chien ? <end>,a t il un chien ? 
 <start> i m all by myself . <end>, <start> je suis tout seul . <end>,je suis tout seul . 
 <start> i am ready . <end>, <start> je suis pret . <end>,je suis pret . 
 <start> most accidents happen in the neighborhood . <end>, <start> la plupart des accidents ont lieu dans le voisinage . <end>,la plupart des accidents surviennent dans le voisinage . 
 <start> he is selfish and greedy . <end>, <start> il est egoiste et cupide . <end>,il est egoiste et cupide . 
 <start> this pen belongs to me . <end>, <start> ce stylo m appartient . <end>,ce stylo m appartient . 
 <start> do you have a mobile phone ? <end>, <start> as tu un portable ? <end>,avez vous un telephone mobile ? 
 <start> he stopped talking . <end>, <start> il s est arrete de parler . <end>,il cessa de parler . 
 <start> the teacher began to ask us questions . <end>, <start> la professeure s est mise a nous poser des questions . <end>,le professeur se mit a nous poser des questions . 
 <start> everything seems to be in order . <end>, <start> tout semble etre en ordre . <end>,tout semble etre en ordre . 
 <start> i can t believe your mom let you go . <end>, <start> je n arrive pas a croire que ta mere t aie laisse partir . <end>,je n arrive pas a croire que votre mere t aie laissee y aller . 
 <start> he is looking for a job . <end>, <start> il est a la recherche d un emploi . <end>,il cherche du travail . 
 <start> i think i did well . <end>, <start> je pense m en etre bien sorti . <end>,je pense m en etre bien sortie . 
 <start> why don t you tell me why you think it happened ? <end>, <start> pourquoi ne me dites vous pas pourquoi vous pensez que c est arrive ? <end>,pourquoi ne me dis tu pas pourquoi tu penses que c est arrive ? 
 <start> i wish you did not have so many problems . <end>, <start> je regrette que tu aies autant d ennuis . <end>,j aurais aime que vous ayez autant de problemes . 
 <start> we re married to each other . <end>, <start> nous sommes maries . <end>,nous sommes maries . 
 <start> he s in grave danger . <end>, <start> il est en danger grave . <end>,il est en danger grave . 
 <start> think about what you want . <end>, <start> reflechissez a ce que vous voulez . <end>,reflechis a ce que tu veux ! 
 <start> i ve seen a lot of him recently . <end>, <start> je l ai vu souvent ces derniers temps . <end>,je l ai vu abondamment . 
 <start> you re a hundred percent right . <end>, <start> vous avez raison a cent pour cent . <end>,tu as raison a cent pour cent . 
 <start> how old is the oldest person you know ? <end>, <start> quel age a la plus vieille personne que tu connais ? <end>,quel age a t il la plus vieille personne que tu connais ? 
 <start> tom sat on a stool in the corner . <end>, <start> tom s assit sur un tabouret dans un coin . <end>,tom s assit sur un trou dans le coin . 
 <start> that girl looks boyish . <end>, <start> cette fille a l air d un garcon . <end>,cette fille ressemble a un garcon . 
 <start> come with us . <end>, <start> venez avec nous . <end>,venez avec nous . 
 <start> marriage changes people . <end>, <start> le mariage change les gens . <end>,le president comprend des gens . 
 <start> italy invaded ethiopia in . <end>, <start> l italie a envahi l ethiopie en mille neuf cent trente cinq . <end>,l italie envahit l ethiopie en mille neuf cent trente cinq . 
" <start> today , i went to the doctor s . <end>"," <start> aujourd hui , j ai ete voir le toubib . <end>",aujourd hui j ai ete voir le medecin . 
 <start> she wouldn t go for a walk with him . <end>, <start> elle ne voulait pas aller se promener avec lui . <end>,elle ne voulait pas se promener avec lui . 
 <start> i can t sing . <end>, <start> je ne sais pas chanter . <end>,je ne peux pas chanter . 
 <start> i d like to ask you something . <end>, <start> je voudrais te demander quelque chose . <end>,j aimerais te demander quelque chose . 
 <start> i m willing to go anywhere you go . <end>, <start> je suis partant pour aller ou que tu ailles . <end>,je suis dispose a me rendre ou que vous alliez . 
 <start> you can come if you want to . <end>, <start> vous pouvez venir si vous voulez . <end>,"tu peux venir , si tu veux . "
 <start> that s an awful idea . <end>, <start> c est une idee terrible . <end>,c est une idee atroce . 
 <start> why did they hire you ? <end>, <start> pourquoi vous ont ils recrutees ? <end>,pourquoi vous ont ils recrutee ? 
 <start> i want to hear from you . <end>, <start> je veux entendre de vos nouvelles . <end>,je veux entendre de toi . 
 <start> get out of my office . <end>, <start> sortez de mon bureau ! <end>,sortez de mon bureau ! 
 <start> it s too bad you can t stay a little longer . <end>, <start> c est dommage que vous ne puissiez pas rester un peu plus lontemps <end>,c est dommage que tu ne puisses pas rester un peu plus longtemps . 
 <start> what do you spend most of your time doing ? <end>," <start> que fais tu , la plupart du temps ? <end>",a quoi passes tu la plupart de ton temps ? 
 <start> i think you need a lawyer . <end>, <start> je pense que vous avez besoin d un avocat . <end>,je pense que vous avez besoin d un avocat . 
