Phrase_a_traduire,Phrase_traduite,Sortie_modele
 <start> they reached their goal . <end>, <start> ils ont atteint leur but . <end>,ils ont atteint leur but . 
 <start> nothing is more valuable than health . <end>, <start> rien n est plus precieux que la sante . <end>,rien n est plus precieux que la sante . 
" <start> if you don t want to go , you don t have to . <end>"," <start> si vous ne voulez pas y aller , vous n y etes pas oblige . <end>","si tu ne veux pas y aller , tu n y es pas oblige . "
 <start> this is my favorite place in this city . <end>, <start> c est mon endroit prefere en ville . <end>,c est mon endroit prefere dans cette ville . 
 <start> i ve brought it back . <end>, <start> je l ai ramene . <end>,je l ai ramene . 
 <start> the music carried me back to my childhood . <end>, <start> la musique m a ramene a mon enfance . <end>,la musique m a ramenee a mon enfance . 
 <start> i m your friend . <end>, <start> je suis votre amie . <end>,je suis votre amie . 
 <start> this is something i must face alone . <end>, <start> c est quelque chose auquel je dois faire face seule . <end>,c est quelque chose auquel je dois faire face seul . 
 <start> i like that shirt . <end>, <start> j aime cette chemise . <end>,j aime cette chemise . 
 <start> i can assure you that you are wrong . <end>, <start> je peux t assurer que tu as tort . <end>,je peux vous assurer que vous avez tort . 
 <start> keep your room as neat as you can . <end>, <start> garde ta chambre aussi propre que tu peux . <end>,maintiens ta chambre aussi propre que tu peux . 
 <start> i no longer have the energy to talk . <end>, <start> je n ai plus la force de discuter . <end>,je n ai plus l energie de parler . 
 <start> show me your tattoo . <end>, <start> montre moi ton tatouage . <end>,montre moi ton tatouage . 
 <start> she wants to live in the city . <end>, <start> elle veut vivre en ville . <end>,elle veut vivre en ville . 
 <start> you need another ten dollars to buy that camera . <end>, <start> tu as encore besoin de dix dollars pour acheter cet appareil photo . <end>,il vous faut encore une autre dix dollars pour acquerir cette camera . 
 <start> you have good reason to be angry . <end>, <start> vous avez une bonne raison d etre en colere . <end>,vous avez de bonnes raisons d etre en colere . 
 <start> i want something to read . <end>, <start> je veux quelque chose a lire . <end>,je veux quelque chose a lire . 
 <start> it s too thin . <end>, <start> c est trop tenu . <end>,c est trop tenu . 
 <start> the number of employees doubled in ten years . <end>, <start> le nombre d employes a double en dix ans . <end>,le nombre de sauterelles explosa dans dix ans . 
 <start> do you want to watch this movie again ? <end>, <start> veux tu regarder ce film a nouveau ? <end>,voulez vous regarder ce film a nouveau ? 
 <start> where do the airport buses leave from ? <end>, <start> d ou partent les bus de l aeroport ? <end>,ou part les cars de l ecole ? 
 <start> why did you try to run away ? <end>, <start> pourquoi avez vous essaye de vous enfuir ? <end>,pourquoi avez vous essaye de vous enfuir ? 
 <start> i went to the scene of the crime . <end>, <start> je me rendis sur le lieu des faits . <end>,je suis alle sur le lieu de crime . 
 <start> i don t believe anything those people say . <end>, <start> je ne crois rien de ce que ces gens disent . <end>,je ne crois pas que tout ce que ces gens disent . 
 <start> nobody showed up today . <end>, <start> personne n a montre son nez aujourd hui . <end>,personne n est venu aujourd hui . 
 <start> i enjoy music . <end>, <start> j apprecie la musique . <end>,j apprecie la musique . 
" <start> okay , i m ready . <end>"," <start> bon , je suis pret . <end>","bon , je suis prete . "
 <start> the nation mourned the death of the king . <end>, <start> la nation pleura la mort du roi . <end>,la nation pleura la mort du roi . 
 <start> my house is near the school . <end>, <start> ma maison se trouve a proximite de l ecole . <end>,ma maison est pres de l ecole . 
 <start> that s all that matters . <end>, <start> c est tout ce qui compte . <end>,c est tout ce qui compte . 
 <start> her sister looks young . <end>, <start> sa s ur semble jeune . <end>,sa s ur semble jeune . 
 <start> keep away from the fire . <end>, <start> restez a distance du feu . <end>,eloignez vous du feu . 
 <start> tom is going to be back later today . <end>, <start> tom rentrera plus tard aujourd hui . <end>,tom va revenir plus tard aujourd hui . 
 <start> children need loving . <end>, <start> les enfants ont besoin d amour . <end>,les enfants ont besoin d amour . 
 <start> he is not interested in art at all . <end>, <start> il ne porte aucun interet a l art . <end>,il n est pas du tout interessee par l art . 
 <start> everyone said that i was wrong . <end>, <start> tout le monde a dit que j avais tort . <end>,tout le monde a dit que j avais tort . 
 <start> the room was warm . <end>, <start> il faisait chaud dans la chambre . <end>,il faisait chaud dans la piece . 
 <start> he s afraid of making mistakes . <end>, <start> il craint de commettre des erreurs . <end>,il a peur de commettre des erreurs . 
 <start> tom was late for work . <end>, <start> tom arriva en retard au travail . <end>,tom etait en retard au travail . 
 <start> you re foolish . <end>, <start> vous etes imprudentes . <end>,vous etes imprudente . 
 <start> do you hit your children ? <end>, <start> frappes tu tes enfants ? <end>,frappes tu tes enfants ? 
 <start> i figured i could count on you . <end>, <start> je me suis imagine que je pourrais compter sur vous . <end>,je me suis imaginee que je pourrais compter sur vous . 
 <start> how much is that ? <end>, <start> c est combien ? <end>,combien est ce que ca coute ? 
 <start> you must turn in your old license in order to get a new one . <end>, <start> il faut rendre sa vieille licence pour en obtenir une nouvelle . <end>,vous devez faire votre assurance permis pour prendre un nouveau . 
" <start> compared to you , i m only a beginner at this game . <end>"," <start> comparee a vous , je ne suis qu une debutante a ce jeu . <end>","comparee a toi , je ne suis qu un debutant a ce jeu . "
 <start> i know i ll be able to do it . <end>, <start> je sais que je serai capable de le faire . <end>,je sais que je vais le faire . 
 <start> i wish i had more time to talk with her . <end>, <start> j aurais aime avoir plus de temps pour parler avec elle . <end>,j aimerais avoir plus de temps pour parler avec elle . 
 <start> there s no food left . <end>, <start> il ne reste pas de nourriture . <end>,il n y a pas de nourriture . 
 <start> it looks a little heavy . <end>, <start> ca semble un peu lourd . <end>,ca a l air un peu lourd . 
 <start> can t you help us ? <end>, <start> ne peux tu pas nous aider ? <end>,ne peux tu pas nous aider ? 
 <start> do you remember seeing me before ? <end>, <start> te rappelles tu m avoir vu auparavant ? <end>,vous rappelez vous m avoir vu auparavant ? 
" <start> i can hear you , but i can t see you . <end>", <start> je t entends mais je ne peux pas te voir . <end>,"je peux t entendre , mais je ne peux pas te voir . "
 <start> my room is twice as large as yours . <end>, <start> ma chambre est deux fois plus grande que la tienne . <end>,ma chambre est deux fois plus grande que le tien . 
 <start> he hurt his left foot when he fell . <end>, <start> il s est blesse au pied gauche lorsqu il est tombe . <end>,il s est fait percer le sol en tombant . 
 <start> is it bad ? <end>, <start> c est grave ? <end>,est ce mauvais ? 
 <start> i asked him if he knew my name . <end>, <start> je lui ai demande s il connaissait mon nom . <end>,je lui ai demande s il connaissait mon nom . 
 <start> are you sure you don t want to keep it ? <end>, <start> etes vous sure de ne pas vouloir la garder ? <end>,es tu sure de ne pas vouloir le garder ? 
 <start> i miss her so much . <end>, <start> elle me manque tellement . <end>,elle me manque tant . 
 <start> now i m done for . <end>, <start> je laisse tomber . <end>,j ai termine . 
 <start> i really hope so . <end>, <start> je l espere vraiment . <end>,j espere vraiment . 
 <start> i left you a note . <end>, <start> je vous ai laisse une note . <end>,je t ai laisse une note . 
 <start> i don t think i can help you . <end>, <start> je ne pense pas que j arrive a vous aider . <end>,je ne pense pas pouvoir vous aider . 
 <start> i repeated what he said exactly as he had said it . <end>," <start> j ai repete ce qu il disait , exactement comme il l avait dit . <end>","j ai interprete ce qu il a dit , ce qu il a dit . "
 <start> i still don t write chinese well . <end>, <start> je n ecris toujours pas bien le chinois . <end>,je n ecris toujours pas bien le chinois . 
 <start> i ve never been so embarrassed . <end>, <start> je n ai jamais ete aussi embarrasse . <end>,je n ai jamais ete aussi embarrasse . 
 <start> are you leaving soon ? <end>, <start> tu pars bientot ? <end>,pars tu bientot ? 
 <start> any further discussion is pointless . <end>, <start> ce n est plus la peine de discuter . <end>,n importe quel moment est futile . 
 <start> i haven t seen you in weeks . <end>, <start> je ne vous ai pas vue depuis des semaines . <end>,je ne vous ai pas vus depuis des semaines . 
 <start> i really hope not . <end>, <start> j espere vraiment que non . <end>,j espere vraiment que non . 
 <start> your lives will be spared . <end>, <start> vos vies seront epargnees . <end>,vos vies seront epargnees . 
 <start> who wants to go first ? <end>, <start> qui veut y aller en premier ? <end>,qui veut y aller en premier ? 
 <start> he preferred working to doing nothing . <end>, <start> il a prefere travailler plutot que de ne rien faire . <end>,il a prefere travailler plutot que de ne rien faire . 
 <start> it s not the answer . <end>, <start> ca ne constitue pas la reponse . <end>,ce n est pas la reponse . 
" <start> believe me , that excuse ain t gonna fly . <end>"," <start> crois moi , cette excuse ne passera pas . <end>","crois moi , cette excuse ne passera pas . "
 <start> what products are currently on sale ? <end>, <start> quels produits sont actuellement en vente ? <end>,quels produits en vente ils a vendre ? 
 <start> tom is a good man . <end>, <start> tom est un homme bon . <end>,tom est un homme bon . 
 <start> he started taking salsa lessons . <end>, <start> il se mit a prendre des cours de salsa . <end>,il commenca a prendre des cours de salsa . 
" <start> pass me the sugar , please . <end>", <start> passez moi le sucre s il vous plait ! <end>,passe moi le sucre s il vous plait . 
" <start> in the speech , he referred to the strength of the company . <end>", <start> dans son discours il se refera a la force de l entreprise . <end>,le discours il se refera a la force de l entreprise . 
 <start> i pulled as hard as i could . <end>, <start> j ai tire aussi fort que j ai pu . <end>,j ai tire aussi dur que j ai pu . 
 <start> did you have a good time on your trip to london ? <end>, <start> t es tu amusee lors de ton voyage a londres ? <end>,avez vous passe un bon moment pour londres ? 
 <start> might i ask your address ? <end>, <start> puis je vous demander votre adresse ? <end>,puis je vous demander votre adresse ? 
 <start> which key is it ? <end>, <start> de quelle cle s agit il ? <end>,quelle cle est elle ? 
" <start> i m sorry , i don t mean to pry . <end>"," <start> je suis desolee , je ne veux pas m immiscer . <end>","je suis desole , je ne veux pas m immiscer . "
 <start> i enjoy your company . <end>, <start> j apprecie votre compagnie . <end>,j apprecie votre entreprise . 
 <start> i m now in a delicate position . <end>, <start> je suis maintenant dans une position delicate . <end>,je suis maintenant dans une position delicate . 
 <start> no one knew who did it . <end>, <start> tout le monde ignorait qui l avait fait . <end>,personne ne savait qui l avait commis . 
 <start> i can t understand what you re trying to get at . <end>, <start> je ne parviens pas a comprendre ce que tu cherches a dire . <end>,je ne peux pas comprendre ce que tu essaies de faire . 
 <start> who wrote the book ? <end>, <start> par qui le livre a t il ete ecrit ? <end>,qui a ecrit le livre ? 
" <start> as soon as i can afford to buy a house , i will . <end>"," <start> des que j ai les moyens d acquerir une maison , je le ferai . <end>","des que je peux me permettre d acheter une maison , je vais . "
 <start> you re being silly . <end>, <start> vous etes idiote . <end>,tu es idiote . 
 <start> who did you buy this for ? <end>, <start> pour qui as tu achete ceci ? <end>,pour qui avez vous achete ceci ? 
 <start> i fully understand your concerns . <end>, <start> je comprends parfaitement tes inquietudes . <end>,je comprends parfaitement tes inquietudes . 
 <start> you can t help yourself . <end>, <start> c est plus fort que toi . <end>,tu ne peux pas t en empecher . 
 <start> this is an effective remedy for crime . <end>, <start> c est un remede efficace contre le crime . <end>,c est un remede efficace pour le crime . 
 <start> i m working too much . <end>, <start> je travaille trop . <end>,je travaille trop . 
 <start> i am so sorry . <end>, <start> je suis tellement desolee ! <end>,je suis tellement desole ! 
 <start> you shouldn t go to school . <end>, <start> tu ne devrais pas te rendre a l ecole . <end>,tu ne devrais pas aller a l ecole . 
 <start> this new macintosh computer puts the competition to shame . <end>, <start> ce nouvel ordinateur macintosh fait honte a la concurrence . <end>,ce nouvel ordinateur macintosh fait honte a la concurrence . 
 <start> italian isn t difficult . <end>, <start> l italien ca n est pas difficile . <end>,"l italien , c est pas difficile . "
" <start> despite all his setbacks , he remains an optimist . <end>"," <start> malgre tous ses revers , il reste optimiste . <end>","malgre tous ses revers , il demeure optimiste . "
 <start> they re not home yet . <end>, <start> elles ne sont pas encore a la maison . <end>,elles ne sont pas encore chez eux . 
 <start> i want something more . <end>, <start> je veux quelque chose de plus . <end>,je veux quelque chose de plus . 
 <start> i only hope it is not too late . <end>, <start> j espere juste que ce n est pas trop tard . <end>,j espere seulement qu il n est pas trop tard . 
 <start> you re early . <end>, <start> vous etes matinale . <end>,tu es matinale . 
 <start> i feel like i m forgeting something . <end>, <start> j ai l impression que j oublie quelque chose . <end>,j ai l impression que j oublie quelque chose . 
 <start> tom was worried about that . <end>, <start> tom etait inquiet a propos de cela . <end>,tom s inquiete pour ca . 
 <start> read lesson from the beginning . <end>, <start> lisez la lecon dix depuis le debut . <end>,lis la lecon dix a partir du debut . 
 <start> we are doing business with many countries . <end>, <start> nous sommes en affaires avec de nombreux pays . <end>,nous faisons des affaires avec de nombreux pays . 
 <start> do you mind if i turn off the ac ? <end>, <start> vois tu un inconvenient a ce que je coupe le courant ? <end>,voyez vous un inconvenient a ce que j eteigne le courant ? 
 <start> can you make me a snack ? <end>, <start> pouvez vous me preparer une collation ? <end>,peux tu me faire un casse croute ? 
 <start> please don t leave me here by myself . <end>," <start> s il vous plait , ne me laissez pas tout seul ici . <end>",je te prie de ne pas me quitter ici . 
 <start> they re really ugly . <end>, <start> elles sont vraiment moches . <end>,elles sont vraiment moches . 
 <start> you re free of all responsibility . <end>, <start> vous etes liberes de toute responsabilite . <end>,vous etes liberee de toute responsabilite . 
 <start> i promise you i ll keep you safe . <end>, <start> je te promets que je te garderai en securite . <end>,je vous promets de vous garder en securite . 
 <start> i got up on the wrong side of the bed this morning . <end>, <start> je me suis leve de mauvais poil ce matin . <end>,je me suis leve de mauvais poil ce matin . 
 <start> what s your favorite holiday ? <end>, <start> quel est ton jour de fete prefere ? <end>,quel est ton jour de fete prefere ? 
 <start> i m going to the bank . <end>, <start> je vais a la banque . <end>,je vais a la banque . 
 <start> don t ever talk to me like that again . <end>, <start> ne me reparle plus jamais ainsi ! <end>,ne me reparlez plus ainsi ainsi ! 
 <start> don t tell me what s possible . <end>, <start> ne me dites pas ce qui est possible ! <end>,ne me dicte pas ce qui est possible ! 
 <start> children often try to imitate their elders . <end>, <start> les enfants essayent souvent d imiter leurs aines . <end>,les enfants essayent souvent d imiter leurs aines . 
 <start> your father s supporters are not limited to his friends . <end>, <start> les partisans de ton pere ne se reduisent pas a ses amis . <end>,les partisans de ton pere ne se reduisent pas a ses amis . 
 <start> it s fall now . <end>," <start> c est l automne , maintenant . <end>","c est l automne , maintenant . "
 <start> health is more important than wealth . <end>, <start> la sante est plus importante que la richesse . <end>,la sante est plus importante que la richesse . 
 <start> i can speak chinese . <end>, <start> je peux parler chinois . <end>,je sais parler chinois . 
 <start> don t you see what s going on ? <end>, <start> ne vois tu pas ce qui est en train de se passer ? <end>,ne vois tu pas ce qui se produit ? 
 <start> the prisoner escaped from prison . <end>, <start> le prisonnier s echappa de prison . <end>,le prisonnier s echappa de prison . 
 <start> you were my friend . <end>, <start> vous futes mon amie . <end>,tu as ete mon amie . 
 <start> it s not like the movies . <end>, <start> ce n est pas comme au cinema . <end>,ce n est pas un film . 
 <start> i should learn french . <end>, <start> je devrais apprendre le francais . <end>,je devrais apprendre le francais . 
 <start> we don t have a cat . <end>, <start> nous n avons pas de chat . <end>,nous n avons pas de chat . 
 <start> i thought you might like to know who s coming over for dinner . <end>, <start> je pensais que vous pourriez apprecier de savoir qui vient diner . <end>,je pensais que vous aimeriez peut etre savoir qui vient diner . 
 <start> he is much smarter than i am . <end>, <start> il est bien plus intelligent que je ne le suis . <end>,il est beaucoup plus intelligent que moi . 
 <start> i awoke to find a bird in my room . <end>, <start> je me reveillai et trouvai un oiseau dans ma chambre . <end>,je me suis reveille pour trouver un oiseau dans ma chambre . 
 <start> is tom still interested ? <end>, <start> tom est il toujours interesse ? <end>,tom est il toujours interesse ? 
 <start> i hope that you aren t afraid . <end>, <start> j espere que tu n as pas peur . <end>,j espere que vous n avez pas peur . 
 <start> some indigenous tribes in brazil are threatened by loggers . <end>, <start> certaines tribus indigenes du bresil sont menacees par les bucherons . <end>,certaines tribus indigenes du bresil sont menacees par les bucherons . 
 <start> she is as beautiful as ever . <end>," <start> elle est belle , comme toujours . <end>",elle est belle comme toujours . 
" <start> i m sorry , but i don t have any small change . <end>", <start> je suis desole mais je n ai pas la moindre petite monnaie . <end>,"je suis desole , mais je n ai pas la moindre petite monnaie . "
 <start> you don t deserve to live . <end>, <start> vous ne meritez pas de vivre . <end>,vous ne meritez pas de vivre . 
 <start> i ll tell you what you want to know . <end>, <start> je vous dirai ce que vous voulez savoir . <end>,je te dirai ce que tu veux savoir . 
 <start> we must observe the rules . <end>, <start> nous devons observer les regles . <end>,nous devons observer les regles . 
" <start> you re not satisfied , are you ? <end>"," <start> tu n es pas content , si ? <end>","tu n es pas satisfait , si ? "
 <start> do you believe in ufos ? <end>, <start> crois tu aux ovnis ? <end>,croyez vous aux ovnis ? 
 <start> you re a good man . <end>, <start> vous etes un homme bien . <end>,tu es un homme formidable . 
 <start> tom told mary he had to talk to her . <end>, <start> tom a dit a mary qu il avait a lui parler . <end>,tom a dit a mary qu il devait lui parler . 
 <start> this isn t mine . <end>, <start> ce n est pas la mienne . <end>,ce n est pas a moi . 
" <start> after eating dinner , i washed the dishes . <end>"," <start> apres avoir soupe , je lavai les plats . <end>","apres diner , je lavai les plats . "
 <start> tom is going to make it on time . <end>, <start> tom va le faire a temps . <end>,tom va le faire a temps . 
 <start> at last he attained his goal . <end>, <start> il atteignit enfin son objectif . <end>,il atteignit enfin son but . 
 <start> i wasn t aware that tom was unhappy here . <end>, <start> je ne savais pas que tom n etait pas heureux ici . <end>,je ne savais pas que tom ne soit pas malheureux ici . 
 <start> his anger is understandable . <end>, <start> sa colere est comprehensible . <end>,sa colere est comprehensible . 
 <start> please be polite . <end>, <start> veuillez vous montrer polis . <end>,sois poli s il te plait . 
 <start> all i can do is to do my best . <end>, <start> tout ce que je peux faire c est faire de mon mieux . <end>,tout ce que je peux faire est de faire de mon mieux . 
 <start> let s go to the mall tonight . <end>, <start> allons au centre commercial ce soir . <end>,allons au centre commercial ce soir . 
 <start> the hotel burned down . <end>, <start> l hotel a ete reduit en cendres . <end>,l hotel s est reduit en cendres . 
" <start> for the time being , i intend to stay at a hotel . <end>"," <start> pour l instant , je compte sejourner a l hotel . <end>","pour le moment , j ai l intention de rester dans un hotel . "
 <start> you did an excellent job . <end>, <start> vous avez fait un excellent travail . <end>,tu as fait un excellent boulot . 
 <start> there s nothing more i can tell you . <end>, <start> il n y a rien que je puisse te dire de plus . <end>,il n y a rien de plus que je puisse te dire . 
 <start> this shouldn t be happening . <end>, <start> cela ne devrait pas se produire . <end>,ca ne devrait pas se produire . 
 <start> let me deal with him . <end>, <start> laissez moi me charger de lui . <end>,laissez moi traiter avec lui . 
 <start> he swims in the river . <end>, <start> il nage dans la riviere . <end>,il nage dans la riviere . 
 <start> this doesn t involve you . <end>, <start> ca ne te concerne pas . <end>,ca ne vous implique pas . 
" <start> she found the evening boring and uninteresting , in short , a waste of time . <end>"," <start> elle a trouve la matinee ennuyeuse et ininteressante , en resume , une perte de temps . <end>","elle a trouve la soiree chimique et lui , en bref sante . "
 <start> i think you and he wanna be alone . <end>, <start> je pense que toi et lui voulez etre seuls . <end>,je crois que vous ne devez etre seuls . 
 <start> we all agree with you . <end>, <start> nous sommes tous d accord avec toi . <end>,nous sommes toutes d accord avec toi . 
 <start> he always cries when he is drunk . <end>, <start> il pleure toujours lorsqu il est saoul . <end>,il pleure toujours lorsqu il est saoul . 
 <start> i d like to talk to the head of security . <end>, <start> j aimerais m entretenir avec le responsable de la securite . <end>,j aimerais m entretenir avec la responsable de la securite . 
 <start> my sister is a good typist . <end>, <start> ma s ur tape bien a la machine . <end>,ma s ur est bonne dactylographe . 
 <start> they made equally tough demands . <end>, <start> ils presenterent des exigences aussi dures . <end>,ils presenterent des exigences aussi dures . 
 <start> it was a good day . <end>, <start> ca a ete une bonne journee . <end>,ca a ete une bonne journee . 
" <start> you knew this was going to happen , right ? <end>"," <start> tu savais que ceci allait arriver , non ? <end>","tu savais que ca allait arriver , n est ce pas ? "
 <start> we have run out of gas . <end>, <start> nous avons une panne d essence . <end>,nous sommes tombes a court d essence . 
 <start> i would ve liked that . <end>, <start> j aurais aime cela . <end>,j aurais aime ca . 
 <start> can you keep a secret ? <end>, <start> pouvez vous garder un secret ? <end>,peux tu garder un secret ? 
 <start> it s been nice meeting you . <end>, <start> ca a ete un plaisir de te rencontrer . <end>,ca fait chouette vous rencontrer . 
 <start> this test doesn t have a time limit . <end>, <start> cet examen n a pas de limite de temps . <end>,ce test n a pas de limite de fraise . 
 <start> he s out now . <end>, <start> il est actuellement a l exterieur . <end>,il est actuellement sorti . 
 <start> i had some fun . <end>, <start> je me suis amuse . <end>,je me suis marree . 
 <start> you re wonderful . <end>, <start> vous etes merveilleux . <end>,vous etes merveilleux . 
 <start> you re ambitious . <end>, <start> vous etes ambitieuses . <end>,tu es ambitieuse . 
 <start> he wants vengeance . <end>, <start> il veut sa vengeance . <end>,il veut sa vengeance . 
 <start> he was at the wrong place at the wrong time . <end>, <start> il se trouvait au mauvais endroit au mauvais moment . <end>,il a eu le mauvais endroit au mauvais moment . 
 <start> i ve tried everything i know to cheer him up . <end>, <start> j ai essaye tout ce que je connais pour lui remonter le moral . <end>,j ai tout essaye de lui remonter le moral . 
 <start> i thought you had somewhere else to be . <end>, <start> je pensais que tu avais un autre endroit ou aller . <end>,je pensais que tu avais quelque endroit ou trouver . 
 <start> i haven t eaten anything since this morning . <end>, <start> je n ai rien mange depuis ce matin . <end>,je n ai rien mange depuis ce matin . 
 <start> how deep is lake biwa ? <end>, <start> quelle est la profondeur du lac biwa ? <end>,quelle profondeur a t il le lac biwa ? 
