Phrase_a_traduire,Phrase_traduite,Sortie_modele
 <start> you re not supposed to eat on the job . <end>, <start> tu n es pas suppose manger sur le lieu de travail . <end>,tu n es pas cense manger sur le lieu de travail . 
 <start> the plane s doors were already closed when tom got to the gate . <end>, <start> les portes de l avion etaient deja fermees quand tom arriva a l embarquement . <end>,les portes etaient deja ferme quand tom a atteint le portail . 
 <start> everybody in the village looks up to him . <end>, <start> tout le monde l admire dans le village . <end>,tout le monde a cherche le village . 
 <start> let me write down the directions for you . <end>, <start> laissez moi vous ecrire les instructions ! <end>,laisse moi t en noter . 
 <start> he was not conscious of my presence here . <end>, <start> il n etait pas conscient de ma presence ici . <end>,il n etait pas conscient de ma presence ici . 
 <start> i was in a better mood three hours ago . <end>, <start> j etais de meilleure humeur il y a trois heures . <end>,j etais de meilleur humeur il y a trois heures . 
 <start> are you sure you want to leave now ? <end>, <start> es tu sur de vouloir partir maintenant ? <end>,es tu sure de vouloir partir maintenant ? 
 <start> you need to find your own way . <end>, <start> il te faut trouver ton propre chemin . <end>,il vous faut trouver votre propre chemin . 
 <start> i want to emphasize the need to get this done on time . <end>, <start> je veux souligner la necessite de le faire faire a temps . <end>,je veux insister sur le besoin de faire ceci a temps . 
 <start> maybe i ll go swimming after school . <end>, <start> peut etre que je vais aller nager apres l ecole . <end>,je vais peut etre nager apres ecole . 
 <start> it was disgusting . <end>, <start> c etait degueulasse . <end>,ca a ete repugnant . 
 <start> my grandmother lives in the country . <end>, <start> ma grand mere vit dans le pays . <end>,ma grand mere vit dans le pays . 
 <start> yes . you re absolutely right . <end>, <start> oui . vous avez parfaitement raison . <end>,oui . tu as parfaitement raison . 
 <start> she married a musician . <end>, <start> elle epousa un musicien . <end>,elle epousa un musicien . 
 <start> i m gullible . <end>, <start> je suis credule . <end>,je suis credule . 
 <start> have you tried this ? <end>, <start> as tu essaye ca ? <end>,avez vous essaye ceci ? 
 <start> he did not intend to hurt your feelings . <end>, <start> il n avait pas l intention de vous blesser . <end>,il n avait pas l intention de te tuer . 
 <start> she divided the cake into five pieces . <end>, <start> elle coupa le gateau en cinq . <end>,elle a partage le tarte en cinq . 
 <start> he is generally at home in the evening . <end>, <start> il est normalement chez lui le soir . <end>,il est normalement chez lui dans la soiree . 
 <start> don t kill the messenger . <end>, <start> ne tuez pas le messager ! <end>,ne tuez pas le messager ! 
 <start> i was alone . <end>, <start> j etais seul . <end>,j etais seul . 
 <start> i can t wait to meet him . <end>, <start> je suis impatient de le rencontrer . <end>,j ai hate de le rencontrer . 
 <start> i ll visit him tomorrow . <end>, <start> je lui rendrai visite demain . <end>,je vais lui rendre visite demain . 
 <start> she has few friends . <end>, <start> elle a peu d amis . <end>,elle a peu d amies . 
 <start> i m not comfortable with this . <end>, <start> je ne suis pas a l aise a ce sujet . <end>,je ne suis pas a l aise avec ca . 
 <start> have you already finished ? <end>, <start> as tu deja fini ? <end>,avez vous deja termine ? 
 <start> there s a yellow rose . <end>, <start> voici une rose jaune . <end>,il y a une rose jaune . 
 <start> where shall we have breakfast today ? <end>, <start> ou petit dejeunerons nous aujourd hui ? <end>,ou prendrons nous notre petit dejeuner aujourd hui ? 
 <start> take a bite . <end>, <start> croquez ! <end>,croquez ! 
" <start> if you have any difficulty , ask me for help . <end>"," <start> si tu as la moindre difficulte , n hesites pas a me demander de l aide . <end>","si vous avez la moindre difficulte , demandez moi de l aide . "
 <start> he died the next day . <end>, <start> il mourut le jour suivant . <end>,il est mort le lendemain suivant . 
 <start> it s incredibly boring . <end>, <start> c est incroyablement ennuyeux . <end>,c est incroyablement ennuyeux . 
 <start> don t you read the tabloids ? <end>, <start> ne lisez vous pas les journaux a scandale ? <end>,ne lisez vous pas les journaux a scandale ? 
 <start> i don t know why i keep doing that . <end>, <start> j ignore pourquoi je continue a faire ca . <end>,je ne sais pas pourquoi je suis en train de faire ca . 
 <start> the doctors did what they could . <end>, <start> les medecins ont fait ce qu ils pouvaient . <end>,les medecins ont fait ce qu ils pouvaient . 
 <start> you re being watched . <end>, <start> on te regarde . <end>,on vous regarde . 
 <start> movie making is an exciting job . <end>, <start> faire des films est un travail allechant . <end>,faire part est un travail allechant . 
 <start> that s very big . <end>, <start> c est tres gros . <end>,c est tres gros . 
 <start> they made me go there . <end>, <start> ils m ont force a y aller . <end>,ils m ont fait aller la . 
 <start> you re wonderful . <end>, <start> tu es merveilleuse . <end>,vous etes merveilleux . 
 <start> he tried to swim against the tide . <end>, <start> il essaya de nager contre la maree . <end>,il essaya de nager contre la maree . 
 <start> the president abolished slavery . <end>, <start> le president a aboli l esclavage . <end>,le president a aboli l esclavage . 
 <start> throw it to tom . <end>, <start> lance le a tom . <end>,jette le a tom . 
 <start> how did you get out of your room ? <end>, <start> comment etes vous sorti de votre chambre ? <end>,comment etes vous sorties de votre chambre ? 
 <start> i thought tom liked riddles . <end>, <start> je croyais que tom aimait les enigmes . <end>,je pensais que tom aimait les enigmes . 
 <start> who baked this cake ? <end>, <start> qui a confectionne ce gateau ? <end>,qui a confectionne ce gateau ? 
 <start> the letter was wrongly addressed . <end>, <start> la lettre etait mal adressee . <end>,la lettre etait mal adressee . 
" <start> he loved me , but he doesn t love me anymore . <end>", <start> il m aimait mais il ne m aime plus . <end>,il m aimait mais il ne m aime plus . 
 <start> he slept all day . <end>, <start> il a dormi toute la journee . <end>,il a dormi toute la journee . 
 <start> did anybody see you ? <end>, <start> quiconque t a t il vu ? <end>,qui que ce soit vous a t il vu ? 
 <start> god sent a sign . <end>, <start> dieu envoya une pancarte . <end>,dieu a envoye un ecriteau . 
 <start> no way ! <end>, <start> c est hors de question ! <end>,c est exclu ! 
 <start> she is stubborn . <end>, <start> elle est obstinee . <end>,elle est obstinee . 
 <start> my place is with them now . <end>," <start> ma place est avec eux , desormais . <end>","ma place est avec eux , desormais . "
 <start> i like that skirt . <end>, <start> j aime cette jupe . <end>,j aime cette jupe . 
 <start> all hope is gone . <end>, <start> tout espoir a disparu . <end>,tout espoir a disparu . 
 <start> excuse my clumsiness . <end>, <start> excusez ma maladresse . <end>,excusez ma maladresse . 
 <start> i m kind of busy tonight . <end>," <start> je suis plutot occupee , ce soir . <end>","je suis plutot occupe , ce soir . "
 <start> tom told mary he had to talk to her . <end>, <start> tom dit a mary qu il avait a lui parler . <end>,tom a dit a mary qu il devait lui parler . 
 <start> a right angle has ninety degrees . <end>, <start> un angle droit mesure degres . <end>,un angle droit mesure degres . 
 <start> i wonder why tennis is played in mini skirts . <end>, <start> je me demande pourquoi on joue au tennis en mini jupe ? <end>,je me demande pourquoi on joue en vacances en mini jupe ? 
 <start> this cat is tom s . <end>, <start> c est le chat de tom . <end>,ce chat est a tom . 
 <start> is anyone absent today ? <end>," <start> quiconque est il absent , aujourd hui ? <end>",qui que ce soit est il absent aujourd hui ? 
 <start> i m now learning french . <end>, <start> j apprends desormais le francais . <end>,j apprends desormais le francais . 
 <start> why did you stop ? <end>, <start> pourquoi t es tu arrete ? <end>,pourquoi avez vous arrete ? 
 <start> i don t want to step on your toes . <end>, <start> je ne veux pas te marcher sur les orteils . <end>,"je ne veux pas y mettre dans les orteils , un point c est tout . "
 <start> tom got an emergency call and had to leave work . <end>, <start> tom a recu un appel urgent et a du partir du travail . <end>,tom a eu un appel urgent et a du partir du travail . 
 <start> we ve got to take tom to the doctor . <end>, <start> nous devons emmener tom au docteur . <end>,il nous faut emmener tom a le medecin . 
 <start> a cold front swept over europe . <end>, <start> une vague de froid attaqua l europe . <end>,un devant froid attaqua l europe . 
 <start> we studied the government s economic policy . <end>, <start> nous avons etudie la politique economique du gouvernement . <end>,nous avons etudie la politique economique du gouvernement . 
 <start> i went there to meet him . <end>, <start> je m y suis rendu pour le rencontrer . <end>,je m y rendis . 
 <start> he lives in his car . <end>, <start> il vit dans sa voiture . <end>,il vit dans sa voiture . 
 <start> he s racking his brains about how to deal with the matter . <end>, <start> il se creuse la tete pour trouver comment regler cette affaire . <end>,il se creuse la tete pour trouver comment il se charger par la affaire . 
 <start> i m happy to be back . <end>, <start> je suis heureux d etre de retour . <end>,je suis heureux d etre de retour . 
 <start> which one of those is yours ? <end>, <start> laquelle de celles la est la votre ? <end>,lequel de ceux la est le votre ? 
 <start> there are no wrong answers . <end>, <start> il n y a pas de mauvaises reponses . <end>,il n y a pas de mauvaises reponses . 
 <start> shouldn t you be at school already ? <end>, <start> ne devrais tu pas deja etre a l ecole ? <end>,ne devrais tu pas etre a l ecole ? 
" <start> most of the plain , simple , everyday things he desires can be secured by people of average means . <end>"," <start> la plupart des choses ordinaires , simples et quotidiennes qu il desire peut etre obtenue par des gens au revenu moyen . <end>","la plupart des choses ordinaires , simples et quotidiennes qu il desire peut etre obtenue par des gens en ligne . "
 <start> let me give you my phone number . <end>, <start> laisse moi te donner mon numero de telephone . <end>,laissez moi vous donner mon numero de telephone . 
 <start> i had a wonderful time . <end>, <start> j ai passe un moment merveilleux . <end>,j ai passe un moment merveilleux . 
 <start> we ve been warned . <end>, <start> nous avons ete averties . <end>,on nous a prevenues . 
 <start> tom took out his wallet to pay the bill . <end>, <start> tom sortit son portefeuille pour payer l addition . <end>,tom a pris son portefeuille pour payer la note . 
 <start> are you at work ? <end>, <start> etes vous au travail ? <end>,etes vous au travail ? 
 <start> we know how important this is . <end>, <start> nous savons a quel point c est important . <end>,nous savons a quel point c est important . 
 <start> do you have a pet ? <end>, <start> avez vous un animal de compagnie ? <end>,avez vous un animal de compagnie ? 
 <start> there is no grass on the moon . <end>, <start> il n y a pas d herbe sur la lune . <end>,il n y a pas d herbe sur la lune . 
 <start> she remained single all her life . <end>, <start> elle a fini vieille fille . <end>,elle est restee celibataire toute sa vie . 
 <start> he was caught by the police . <end>, <start> il a ete arrete par la police . <end>,il a ete pris par la police . 
 <start> you didn t miss a thing . <end>, <start> tu n as rien manque . <end>,tu n as rien manque . 
 <start> tom said that he regretted his decision . <end>, <start> tom a dit qu il regrettait sa decision . <end>,tom a dit qu il regrettait sa decision . 
 <start> try to avoid junk food . <end>, <start> essayez d eviter la malbouffe . <end>,essayez d eviter la malbouffe . 
 <start> are you watching carefully ? <end>, <start> regardes tu attentivement ? <end>,regardez vous attentivement ? 
 <start> you should get yourself examined by the doctor immediately . <end>, <start> tu devrais immediatement aller te faire examiner par le medecin . <end>,tu ferais mieux de te faire examiner par le medecin . 
 <start> don t worry about that now . <end>, <start> ne t inquiete pas a propos de ca maintenant . <end>,ne te fais pas de souci a propos de ca maintenant . 
 <start> i think i ll go to boston next weekend . <end>, <start> je pense que je vais aller a boston le weekend prochain . <end>,je pense que je vais aller a boston le week end prochain . 
 <start> the rain didn t stop them from doing their job . <end>, <start> la pluie ne les a pas empeches de faire leur travail . <end>,la pluie ne les a pas empeches de faire leur travail . 
 <start> how do you usually decide what to eat ? <end>, <start> comment decides tu habituellement quoi manger ? <end>,comment decidez vous habituellement quoi manger ? 
 <start> she couldn t put up with his rudeness any more . <end>, <start> elle ne pouvait plus supporter sa grossierete . <end>,elle ne pouvait plus supporter sa grossierete . 
 <start> tom knew that mary loved john . <end>, <start> tom savait que mary aimait john . <end>,tom savait que mary pleurait john . 
 <start> her late husband was a violinist . <end>, <start> son dernier mari etait violoniste . <end>,son dernier mari etait violoniste . 
 <start> someone is watching tom . <end>, <start> quelqu un est en train de regarder tom . <end>,quelqu un est en train de regarder tom . 
 <start> i was aware of that . <end>, <start> j en etait conscient . <end>,j etais consciente de cela . 
 <start> she was standing on a ladder painting the ceiling . <end>," <start> elle se tenait sur une echelle , en train de peindre le plafond . <end>",elle etait debout sur une echelle echelle le plafond . 
 <start> i ve had enough . <end>, <start> ca suffit . <end>,j en ai assez supporte . 
 <start> our feud traces back to our childhood . <end>, <start> notre inimitie remonte a notre enfance . <end>,notre inimitie remonte a notre enfance . 
 <start> he can t cook very well . <end>, <start> il ne sait pas tres bien cuisiner . <end>,il ne sait pas tres bien cuisiner . 
 <start> she s a single mother of two . <end>, <start> elle est mere isolee de deux enfants . <end>,c est une mere isolee de deux . 
 <start> can you hear us ? <end>, <start> parviens tu a nous entendre ? <end>,arrives tu a nous entendre ? 
 <start> to learn a foreign language requires a lot of time . <end>, <start> apprendre une langue etrangere requiert beaucoup de temps . <end>,apprendre une langue etrangere requiert beaucoup de temps . 
 <start> why do you have your umbrella up ? it s not raining . <end>, <start> pourquoi tenez vous votre parapluie en l air ? il ne pleut pas . <end>,pourquoi avez vous votre parapluie ? 
 <start> the plan has worked well . <end>, <start> le plan a bien marche . <end>,le plan a bien marche . 
 <start> she mended her socks . <end>, <start> elle repara ses chaussettes . <end>,elle repara ses chaussettes . 
 <start> i m laying you off . <end>, <start> je te licencie . <end>,je vous licencie . 
 <start> how many people were at your party ? <end>, <start> combien de gens etaient a votre fete ? <end>,combien de personnes etaient a votre fete ? 
 <start> i don t love you that much . <end>, <start> je ne t aime pas tant que ca . <end>,je ne vous aime pas tant que ca . 
 <start> are you happy with your weight ? <end>, <start> es tu satisfait de ton poids ? <end>,etes vous satisfaite de votre poids ? 
 <start> did you go straight home after school yesterday ? <end>," <start> etes vous directement rentre chez vous hier , apres l ecole ? <end>","etes vous directement rentre chez vous hier , apres l ecole ? "
 <start> he loves to party . <end>, <start> il adore faire la nouba . <end>,il aime faire la fete . 
 <start> i d like to reserve a seat . <end>, <start> j aimerais reserver un fauteuil . <end>,j aimerais reserver une place assise . 
 <start> he is likely to arrive soon . <end>, <start> il est probable qu il arrive bientot . <end>,il est probable qu il arrive bientot . 
 <start> the dog barks at all strangers . <end>, <start> ce chien aboie envers tous les inconnus . <end>,le chien aboie a tous les inconnus . 
 <start> how long does it take to get to vienna on foot ? he inquired . <end>," <start> combien de temps cela prend il pour se rendre a vienne a pied ? , s enquit il . <end>",combien de temps cela prend il pour se rendre a pied ? s enquit il . 
 <start> tom has a voracious appetite . <end>, <start> tom a un appetit vorace . <end>,tom a un appetit vorace . 
 <start> let s meet on sunday . <end>, <start> rencontrons nous dimanche . <end>,rencontrons nous dimanche . 
 <start> do you think your parents spent enough time with you when you were in your teens ? <end>, <start> pensez vous que vos parents ont passe suffisamment de temps avec vous lorsque vous etiez adolescentes ? <end>,pensez vous que vos parents ont passe suffisamment de temps avec vous lorsque vous etiez adolescente ? 
 <start> over people were arrested . <end>, <start> plus de trois cents personnes ont ete arretees . <end>,plus de gens ont ete arretees . 
 <start> i really enjoy spending time with you . <end>, <start> j apprecie vraiment le temps que je passe en votre compagnie . <end>,j adore vraiment passer du temps avec toi . 
 <start> i am afraid you have the wrong number . <end>, <start> j ai bien peur que vous n ayez un mauvais numero . <end>,j ai peur que tu aies mauvais numero . 
 <start> we must decide . <end>, <start> il nous faut decider . <end>,il nous faut decider . 
 <start> she has a little bread . <end>, <start> elle a un peu de pain . <end>,elle a un peu de pain . 
 <start> your garden needs some attention . <end>, <start> votre jardin a besoin d un peu d attention . <end>,votre jardin a besoin de attention . 
 <start> he made up an excuse . <end>, <start> il a invente une excuse . <end>,il a invente une excuse . 
 <start> i didn t understand the meaning . <end>, <start> je n ai pas compris ce que ca signifiait . <end>,je n ai pas compris ce sens . 
 <start> tom was there for me when i really needed someone . <end>," <start> tom fut la pour moi , quand j eus vraiment besoin de quelqu un . <end>","tom etait la pour moi , quand j avais vraiment besoin de quelqu un . "
 <start> i can t just stay here . <end>, <start> je ne me resous pas a juste rester ici . <end>,je ne peux pas simplement rester ici . 
 <start> tom can t make it tonight . <end>, <start> tom ne pourra pas etre la ce soir . <end>,tom ne peut pas le faire ce soir . 
 <start> i don t know what that is . <end>, <start> j ignore ce dont il s agit . <end>,j ignore ce que c est . 
 <start> tom spoke in french . <end>, <start> tom parla en francais . <end>,tom parla en francais . 
 <start> he was standing . <end>, <start> il se tenait debout . <end>,il etait debout . 
 <start> i had to get back home . <end>, <start> j ai du retourner chez moi . <end>,il m a fallu de retour a la maison . 
 <start> i ended up winning . <end>, <start> j ai fini par gagner . <end>,je finis par gagner . 
 <start> tom tried to conceal the truth . <end>, <start> tom essaya de cacher la verite . <end>,tom essaya de dissimuler la verite . 
 <start> you must be starving . <end>, <start> vous devez mourir de faim . <end>,vous devez mourir de faim . 
 <start> could you send this letter to japan ? <end>, <start> pouvez vous envoyer cette lettre au japon ? <end>,pourriez vous envoyer cette lettre au japon ? 
 <start> she said that she was happy . <end>, <start> elle dit qu elle etait heureuse . <end>,elle a dit qu elle etait heureuse . 
 <start> i can t believe this is happening . <end>, <start> je n arrive pas a croire que ca se produit . <end>,je n arrive pas a croire que ca arrive . 
 <start> he doesn t know much about japan . <end>, <start> il ne sait pas grand chose du japon . <end>,il ne sait pas grand chose du japon . 
 <start> i first met him three years ago . <end>, <start> je l ai rencontre pour la premiere fois il y a trois ans . <end>,je l ai rencontre pour la premiere fois il y a trois ans . 
 <start> i expect much of him . <end>, <start> j attends beaucoup de lui . <end>,j espere beaucoup de lui . 
 <start> tell tom i don t know where he parked his car . <end>, <start> dites a tom que je ne sais pas ou il a gare sa voiture . <end>,dis a tom que je ne sais pas ou il a gare sa voiture . 
 <start> tom doesn t read much anymore . <end>, <start> tom ne lit plus beaucoup . <end>,tom ne lit plus bien . 
 <start> write in the date yourself . <end>, <start> ecris toi meme la date dessus . <end>,ecrivez vous meme la date dessus . 
 <start> they agreed on everything . <end>, <start> elles s accorderent sur tout . <end>,ils s accorderent sur tout . 
 <start> let tom make the decisions . <end>, <start> laissez tom prendre les decisions . <end>,laissez tom faire les decisions . 
 <start> i was celebrating . <end>, <start> je celebrais . <end>,j arrose ca . 
 <start> tom backed up his data . <end>, <start> tom a sauvegarde ses donnees . <end>,thomas pressa ses donnees . 
 <start> i think we ve met before . <end>, <start> je pense que nous nous sommes deja rencontres . <end>,je pense que nous nous sommes deja rencontres . 
 <start> do i have to pay you ? <end>, <start> dois je te payer ? <end>,dois je vous payer ? 
 <start> why don t you love me ? <end>, <start> et si tu m aimais ? <end>,pourquoi ne m aimes tu pas ? 
 <start> i couldn t look at it any longer . <end>, <start> je ne pouvais pas la regarder plus longtemps . <end>,je n ai plus pu le regarder plus longtemps . 
 <start> she always fed her children before she fed her dog . <end>, <start> elle nourrissait toujours ses enfants avant de nourrir son chien . <end>,elle nourrissait toujours ses enfants avant de nourrir son chien . 
 <start> words cannot convey my feelings . <end>, <start> je ne peux exprimer ce que je ressens avec des mots . <end>,les mots ne peuvent transmettre mes sentiments . 
 <start> approximately houses were built here last year . <end>, <start> environ maisons ont ete construites ici l annee derniere . <end>,environ maisons ont ete construites ici l an dernier . 
 <start> the station is the middle of the city . <end>, <start> la gare est dans le centre de la ville . <end>,la gare est le milieu de la ville . 
 <start> they struggled . <end>, <start> ils ont morfle . <end>,ils ont eu du mal . 
 <start> he could do it . <end>, <start> lui pourrait le faire . <end>,il pourrait le faire . 
 <start> please tell me which of the two cameras is better . <end>, <start> veuillez m indiquer quel appareil photo est le meilleur . <end>,dis moi laquelle des deux appareils photo est le meilleur . 
 <start> i m going to be late for the meeting . <end>, <start> je vais etre en retard pour la reunion . <end>,je vais etre en retard pour la reunion . 
 <start> do you meet him often ? <end>, <start> le rencontres tu souvent ? <end>,le rencontres tu souvent ? 
 <start> i ve come to ask you a favor . <end>, <start> je suis venue vous demander une faveur . <end>,je suis venu te demander une faveur . 
 <start> when did you last see my brother ? <end>, <start> quand avez vous vu mon frere pour la derniere fois ? <end>,quand avez vous vu mon telephone ? 
 <start> it s wednesday . <end>, <start> on est mercredi . <end>,on est mercredi . 
 <start> they danced all night long . <end>, <start> elles danserent toute la nuit . <end>,ils ont danse toute la nuit . 
 <start> i need more power . <end>, <start> j ai besoin de plus d electricite . <end>,j ai besoin de plus de puissance . 
 <start> i think you should stop giving tom money . <end>, <start> je pense que tu devrais arreter de donner de l argent a tom . <end>,je pense que vous devriez arreter de donner de l argent a tom . 
 <start> all i think about is you . <end>," <start> tout ce a quoi je pense , c est vous . <end>","tout ce a quoi je pense , c est toi . "
 <start> tom disobeyed a direct order from a superior officer . <end>, <start> tom a desobei a un ordre direct d un officier superieur . <end>,tom a conteste un ordre emanant d un superieur hierarchique . 
 <start> he asked that we be silent . <end>, <start> il nous demanda d etre silencieuses . <end>,il nous demanda d etre silencieuses . 
 <start> i m sick of english . <end>, <start> j en ai marre de l anglais . <end>,j en ai assez de l anglais . 
 <start> let s give tom some privacy . <end>, <start> donnons un peu d intimite a tom . <end>,donnons un intimite a tom . 
 <start> would you mind if i went home early ? <end>, <start> verrais tu un inconvenient a ce que je rentre tot a la maison ? <end>,verriez vous un inconvenient a ce que je vais chez moi tot ? 
 <start> what foreign languages have you studied ? <end>, <start> quelles langues etrangeres as tu etudiees ? <end>,quelles langues etrangeres as tu etudiees ? 
 <start> he has a pleasant voice . <end>, <start> il a une voix agreable . <end>,il a une grosse voix . 
 <start> i don t know anybody else here . <end>," <start> je ne connais personne d autre , ici . <end>",je ne connais personne d autre ici . 
 <start> why limit yourself to just one ? <end>, <start> pourquoi te limiter a un seul ? <end>,pourquoi vous limiter a une seule ? 
 <start> i know it s not easy . <end>, <start> je sais que ce n est pas facile . <end>,je sais que ce n est pas facile . 
 <start> my sister is bugging me . <end>, <start> ma s ur me casse les pieds . <end>,ma s ur m embete . 
