Phrase_a_traduire,Phrase_traduite,Sortie_modele
 <start> nobody suspected anything . <end>, <start> personne ne se douta de rien . <end>,personne ne se douta de rien . 
 <start> the strike affected the nation s economy . <end>, <start> la greve a nui a l economie nationale . <end>,la greve a affecte l economie nationale . 
 <start> has anyone seen tom ? <end>, <start> quelqu un a t il vu tom ? <end>,qui que ce soit a t il vu tom ? 
 <start> the mailman emptied the mailbox . <end>, <start> le postier vida la boite aux lettres . <end>,le postier vida la boite aux lettres . 
 <start> a good sweat will cure a cold . <end>, <start> une bonne suee guerira un rhume . <end>,une bonne suee guerira un froid . 
 <start> what exactly don t you get ? <end>," <start> qu est ce que tu ne piges pas , exactement ? <end>","qu est ce que tu ne captes pas , exactement ? "
 <start> do you feel like going swimming ? <end>, <start> as tu envie d aller nager ? <end>,avez vous envie d aller nager ? 
 <start> i haven t finished all my homework yet . <end>, <start> je n ai pas encore termine tous mes devoirs . <end>,je n ai pas encore termine tous mes devoirs . 
 <start> does the end justify the means ? <end>, <start> est ce que la fin justifie les moyens ? <end>,la fin justifie t elle les moyens ? 
 <start> i want to go somewhere on a trip . <end>, <start> j ai envie de partir en voyage . <end>,je veux partir en voyage . 
 <start> he works long hours . <end>, <start> il travaille de longues heures . <end>,il travaille de longues heures . 
 <start> don t talk about work . we re on vacation . <end>, <start> ne parle pas de travail . nous sommes en vacances . <end>,ne parle pas de travail ! nous sommes en vacances . 
 <start> tom disobeyed a direct order from a superior officer . <end>, <start> tom a conteste un ordre emanant d un superieur hierarchique . <end>,tom a conteste un ordre emanant d un superieur hierarchique . 
 <start> you were incompetent . <end>, <start> tu etais incompetent . <end>,tu etais incompetente . 
 <start> did tom talk to you about mary ? <end>, <start> tom vous a il parle de mary ? <end>,est ce que tom t a parle de mary ? 
 <start> i have to change clothes . <end>, <start> je dois changer de vetements . <end>,il me faut changer de vetements . 
 <start> i ve been given permission to inspect this equipment . <end>, <start> on m a autorise a inspecter cet equipement . <end>,on lui promit d accepter ce permis . 
 <start> tom said that mary was very unhappy . <end>, <start> tom a dit que mary etait tres malheureuse . <end>,tom a dit que mary etait tres malheureuse . 
 <start> nobody was home . <end>, <start> personne n etait chez nous . <end>,personne n etait chez moi . 
 <start> we want more money . <end>, <start> nous voulons davantage d argent . <end>,nous voulons davantage d argent . 
 <start> i am tired . <end>, <start> je suis fatigue ! <end>,je suis fatigue . 
 <start> i need you to stay here . <end>, <start> j ai besoin que vous restiez ici . <end>,j ai besoin que tu restes ici . 
 <start> tom found me a taxi . <end>, <start> tom m a trouve un taxi . <end>,tom m a trouve un taxi . 
 <start> a lot of people are waiting to see what is going to happen . <end>, <start> beaucoup de gens attendent de voir ce qui va survenir . <end>,beaucoup de gens attendent de voir ce qui va arriver . 
 <start> keep searching . <end>, <start> continuez a chercher . <end>,continuez a chercher . 
 <start> i fell down the stairs . <end>, <start> je suis tombee dans les escaliers . <end>,je suis tombee dans les escaliers . 
" <start> i m sorry , i really am . <end>"," <start> je suis desole , vraiment . <end>","je suis desole , je suis vraiment . "
 <start> he s got the biggest eyebrows i ve ever seen . <end>, <start> il a les plus gros sourcils que j ai jamais vus . <end>,il a les plus grandes plus de sourcils que j ai jamais vu . 
 <start> you have got to be kidding me . <end>, <start> vous devez etre en train de me charrier . <end>,vous devez plaisanter ! 
 <start> let s review the evidence . <end>, <start> passons en revue les elements de preuve . <end>,passons en revue les elements de preuve . 
 <start> you might have told me . <end>, <start> tu aurais pu me le dire . <end>,il se pourrait que vous me l ayez dit . 
" <start> in addition to this , there are other reasons . <end>"," <start> par la dessus , il y a d autres raisons . <end>","en plus de ceci , il y a d autres raisons . "
 <start> why are they so upset ? <end>, <start> pourquoi sont ils si enerves ? <end>,pourquoi sont elles si enervees ? 
 <start> she s six years older than me . <end>, <start> elle est six ans plus agee que moi . <end>,elle est six ans que moi . 
 <start> he is a fast runner . <end>, <start> c est un coureur rapide . <end>,c est un coureur rapide . 
 <start> don t they drive you mad ? <end>, <start> ne vous rendent elles pas fous ? <end>,ne vous rendent elles pas folle ? 
 <start> we love our customers . <end>, <start> nous adorons nos clients . <end>,nous adorons nos clients . 
 <start> we cannot live without air . <end>, <start> nous ne pouvons pas vivre sans air . <end>,nous ne pouvons vivre sans air . 
 <start> the leaves have turned red . <end>, <start> les feuilles sont devenues rouges . <end>,les feuilles virent au rouge . 
 <start> have you been up all night ? <end>, <start> as tu ete debout toute la nuit ? <end>,as tu passe toute la nuit ? 
 <start> that s very good news . <end>, <start> ce sont la d excellentes nouvelles . <end>,c est tres bonnes nouvelles . 
 <start> don t cross this bridge . <end>, <start> ne traverse pas ce pont . <end>,ne traversez pas ce pont . 
 <start> i don t have a fever . <end>, <start> je n ai pas de fievre . <end>,je n ai pas de fievre . 
" <start> while in london , he visited the british museum . <end>"," <start> pendant qu il sejournait a londres , il visita le british museum . <end>","en londres , il visita le british museum . "
 <start> why am i still alive ? <end>, <start> pourquoi suis je toujours en vie ? <end>,pourquoi suis je encore en vie ? 
 <start> bad weather kept us from going out . <end>, <start> le mauvais temps nous a empechees de sortir . <end>,le mauvais temps nous empecha de sortir . 
 <start> i m calling the cops . <end>, <start> j appelle les flics . <end>,j appelle les flics . 
 <start> you must not give up . <end>, <start> il ne faut pas que vous abandonniez . <end>,vous ne devez pas abandonner . 
 <start> i ll give you a present . <end>, <start> je te donnerai un cadeau . <end>,je te donnerai un cadeau . 
 <start> a lot of fish perished . <end>, <start> de nombreux poissons sont morts . <end>,beaucoup de poissons ont peri . 
 <start> i eat because i m hungry . <end>, <start> je mange parce que j ai faim . <end>,je mange parce que j ai faim . 
 <start> the earth s moon is a natural satellite . <end>, <start> la lune de la terre est un satellite naturel . <end>,la lune de la terre est un satellite naturel . 
" <start> if he d known the truth , he d have told me . <end>"," <start> s il avait connu la verite , il me l aurait dite . <end>","s il avait connu la verite , il me l aurait dite . "
 <start> you crossed the line . <end>, <start> tu as franchi la ligne . <end>,vous avez franchi la ligne . 
 <start> space travel is dangerous . <end>, <start> les voyages spatiaux sont dangereux . <end>,voyages spatiaux est dangereux . 
 <start> your chinese is awesome already . <end>," <start> ton chinois est super , deja . <end>",votre chinois est deja genial . 
 <start> you and i are the same age . <end>, <start> vous et moi sommes du meme age . <end>,toi et moi sommes pareils . 
 <start> we have to respect local customs . <end>, <start> nous devons respecter les coutumes locales . <end>,nous devons respecter les coutumes locales . 
 <start> i ve been feeling this way all day . <end>, <start> je me suis senti comme ca toute la journee . <end>,je me suis senti ainsi toute la journee . 
 <start> i just need a hug . <end>, <start> j ai juste besoin d un calin . <end>,j ai juste besoin d un calin . 
 <start> her office is on the other side of the street . <end>, <start> son bureau est de l autre cote de la rue . <end>,son bureau est de l autre cote de la rue . 
 <start> i got together with her mainly because we seemed to share the same feelings about things . <end>, <start> je me suis mis avec elle principalement pour la raison qu on semblait partager les memes sentiments sur la vie . <end>,je suis parti avec elle principalement parce qu on semblait partager les memes sentiments sur la vie allumee . 
 <start> he does not care for any sport involving team work or quick responses to other players . <end>, <start> il n a pas d interet pour quelque sport impliquant un travail d equipe ou des reponses rapides a d autres joueurs . <end>,il ne s interesse pas d un travail d equipe ou des reponses avec des reponses a part . 
 <start> i m in no hurry . <end>, <start> je ne suis pas presse . <end>,je ne suis pas pressee . 
 <start> their work seems good to me . <end>, <start> leur travail me semble bon . <end>,leur travail me convient . 
 <start> i need evidence . <end>, <start> il me faut des preuves . <end>,il me faut des preuves . 
 <start> he s a construction worker . <end>, <start> il est employe dans le batiment . <end>,c est un travailleur du batiment . 
 <start> that ll put you in danger . <end>, <start> cela te mettra en danger . <end>,ca te mettra en danger . 
 <start> i ve already read this book . <end>, <start> j ai deja lu ce livre . <end>,j ai deja lu ce livre . 
 <start> what s wrong with you ? <end>, <start> c est quoi ton probleme ? <end>,qu est ce qui ne va pas avec toi ? 
 <start> tom brought a blanket . <end>, <start> tom a apporte une couverture . <end>,tom a apporte une couverture . 
 <start> the hero finally defeated the evil scientist . <end>, <start> le heros vainquit finalement le mechant scientifique . <end>,le heros vainquit finalement le mechant scientifique . 
 <start> it looks like your dog is thirsty . <end>, <start> ton chien semble avoir soif . <end>,on dirait ton chien a soif . 
 <start> do you play tennis ? <end>, <start> tu joues au tennis ? <end>,jouez vous au tennis ? 
 <start> he doesn t know me . <end>, <start> il ne me connait pas . <end>,il ne me connait pas . 
" <start> i m fairly busy , actually . <end>"," <start> je suis assez occupe , en realite . <end>","je suis plutot occupee , en verite . "
 <start> i never thought i would have to support such a large family . <end>, <start> je n aurais jamais pense que j aurais a entretenir une famille aussi grande . <end>,je n ai jamais pense que je devrais entretenir une famille pareille . 
 <start> i dropped my keys . <end>, <start> j ai fait tomber mes cles . <end>,j ai laisse mes cles . 
 <start> i really don t have anything else to say . <end>, <start> je n ai vraiment rien a dire d autre . <end>,je n ai vraiment rien d autre a dire . 
 <start> i don t know anything about the future . <end>, <start> je ne sais rien du futur . <end>,je ne connais rien du futur . 
 <start> i m certain that he ll come . <end>, <start> je suis sur qu il viendra . <end>,je suis certaine qu il viendra . 
 <start> i am reading a book about animals . <end>, <start> je lis un livre sur les animaux . <end>,je lis un livre sur les animaux . 
 <start> the boy feared the dark . <end>, <start> le garcon avait peur des tenebres . <end>,le garcon avait peur du noir . 
 <start> i wish i had known how to do it . <end>, <start> j aurais voulu savoir comment le faire . <end>,j aurais voulu savoir comment le faire . 
 <start> i thought you wouldn t like it . <end>, <start> je pensais que tu n aimerais pas . <end>,je pensais que tu n aimerais pas ca . 
 <start> sometimes we lie to keep from hurting someone else s feelings . <end>, <start> on ment parfois pour ne pas blesser l autre . <end>,on ment parfois pour ne pas avoir de l autre . 
 <start> what you said makes absolutely no sense to me . <end>, <start> ce que tu as dit n a pour moi absolument aucun sens . <end>,ce que vous avez dit n a absolument aucun sens pour moi . 
 <start> i can t let you in there . <end>, <start> je ne peux pas vous autoriser a entrer la . <end>,je ne peux pas vous le permettre . 
 <start> i expect that tom will pass the exam . <end>, <start> je m attends a ce que tom ait son examen . <end>,j estime que tom reussisse l examen . 
 <start> why didn t you talk to me about it ? <end>, <start> pourquoi ne m en as tu pas parle ? <end>,pourquoi ne m en avez vous pas parle ? 
 <start> that was nice . <end>, <start> c etait sympa . <end>,c etait chouette . 
 <start> you d better come . <end>, <start> vous feriez mieux de venir . <end>,tu ferais mieux de venir . 
 <start> there was fear in his eyes . <end>, <start> il y avait de la peur dans ses yeux . <end>,il y avait la peur dans ses yeux . 
 <start> anything else ? <end>, <start> autre chose ? <end>,autre chose ? 
 <start> tom said that he was going to be late . <end>, <start> tom a dit qu il allait etre en retard . <end>,tom a dit qu il allait etre en retard . 
 <start> tom didn t come to school today because he had to go to a funeral . <end>, <start> tom n est pas venu a l ecole aujourd hui parce qu il devait aller a un enterrement . <end>,tom n est pas venu a l ecole aujourd hui parce qu il devait se rendre a un enterrement . 
 <start> my hands were shaking too much to thread the needle . <end>, <start> mes mains tremblaient trop pour enfiler l aiguille . <end>,mes mains tremblent trop pour enfiler l aiguille . 
 <start> she gave me an album as a birthday present . <end>, <start> elle m a offert un album en tant que cadeau d anniversaire . <end>,elle m a donne un cadeau pour un cadeau d anniversaire . 
 <start> can we get some sleep ? <end>, <start> on peut dormir un peu ? <end>,pouvons nous avoir un peu de sommeil ? 
 <start> i suppose we could walk . <end>, <start> je suppose que nous pourrions marcher . <end>,je pense que nous pourrions marcher . 
" <start> would you tell me the time , please ? <end>"," <start> voudrais tu , je te prie , m indiquer l heure ? <end>","pourriez vous me dire l heure , s il vous plait ? "
 <start> you re not telling the truth . <end>, <start> vous ne dites pas la verite . <end>,tu ne dis pas la verite . 
 <start> this company is indifferent to the safety of its workers . <end>, <start> cette entreprise est indifferente a la securite de ses employes . <end>,cette entreprise est indispensable a la securite de ses salaries . 
 <start> are you sincere ? <end>, <start> etes vous sincere ? <end>,es tu sincere ? 
 <start> i think of you as a friend . <end>, <start> je pense a vous en tant qu ami . <end>,je pense a vous en tant qu amie . 
 <start> she is a very intelligent young lady . <end>, <start> c est une jeune femme tres intelligente . <end>,c est une jeune fille tres intelligent . 
 <start> i knew too much . <end>, <start> j en savais trop . <end>,je savais trop . 
 <start> you re in love . <end>, <start> vous etes amoureuse . <end>,tu es amoureuse . 
 <start> they are not sisters . <end>, <start> elles ne sont pas s urs . <end>,ils sont pas s urs . 
 <start> advertising sells products over the air . <end>, <start> la publicite vend des produits sur les ondes . <end>,la publicite vend des produits sur les ondes . 
 <start> tom s alone . <end>, <start> tom est tout seul . <end>,tom est tout seul . 
 <start> they re idiots . <end>, <start> ils sont idiots . <end>,elles sont idiots . 
 <start> i m here to see the manager . <end>, <start> je suis ici pour voir le gerant . <end>,je suis ici pour voir le gerant . 
 <start> what part of australia do you come from ? <end>, <start> de quelle partie de l australie venez vous ? <end>,de quel coin de australie venez vous ? 
 <start> i ll give you as many as you like . <end>, <start> je vous en donnerai autant que vous en voulez . <end>,je te donnerai autant que tu en veux . 
 <start> this boat is seaworthy . <end>, <start> le navire est en etat de naviguer . <end>,le prisonnier est en etat de etat . 
 <start> i was so disappointed . <end>, <start> j etais tellement decue . <end>,j etais tellement decu . 
 <start> how about running ? <end>, <start> si on allait courir ? <end>,et si nous courions ? 
 <start> how many kinds are there ? <end>, <start> combien y en a t il de sortes ? <end>,combien y a t il de sortes ? 
 <start> i m very happy . <end>, <start> je suis tres heureux . <end>,je suis tres heureux . 
 <start> women feel that men are often very complicated . <end>, <start> les femmes trouvent que les hommes sont souvent tres compliques . <end>,les femmes se sont souvent si compliquees . 
 <start> i hear tom was the one who taught you how to play the cello . <end>, <start> j ai entendu que c est tom qui t a appris a jouer du violoncelle . <end>,j ai entendu que tom etait celui qui t a appris a jouer du violoncelle . 
 <start> they live near the beach . <end>, <start> ils vivent pres de la plage . <end>,ils habitent pres de la plage . 
 <start> do you plan to go abroad ? <end>, <start> prevoyez vous de vous rendre a l etranger ? <end>,prevois tu de te rendre a l etranger ? 
" <start> i didn t feel well , but i went to work . <end>"," <start> je ne me sentais pas bien , mais je suis alle travailler . <end>","je n ai pas bien reussi , mais je suis alle travailler . "
 <start> i bet you know french . <end>, <start> je parie que tu connais le francais . <end>,je parie que vous savez le francais . 
 <start> i know you re not like that . <end>, <start> je sais que tu n es pas comme ca . <end>,je sais que tu n es pas comme ca . 
 <start> he died of a heart attack . <end>, <start> il est mort d une crise cardiaque . <end>,il est mort d une crise cardiaque . 
 <start> he asked me for money . <end>, <start> il m a demande de l argent . <end>,il m a demande de l argent . 
 <start> what s your favorite item of clothing ? <end>, <start> quel est ton vetement prefere ? <end>,quel est ton marque de portee ? 
 <start> are you with the fbi ? <end>, <start> es tu avec le fbi ? <end>,etes vous avec le fbi ? 
 <start> she held him like mother gorillas hold their babies . <end>, <start> elle le tint de la maniere dont les meres gorilles tiennent leurs bebes . <end>,elle le tint de la maniere aux meres gorilles tiennent leurs bebes . 
 <start> everyone s dead . <end>, <start> tout le monde est mort . <end>,tout le monde est mort . 
 <start> i almost forgot all about that . <end>, <start> j ai presque tout oublie a ce sujet . <end>,j ai presque tout oublie a propos de cela . 
 <start> may i borrow your dictionary ? <end>, <start> puis je emprunter ton dictionnaire ? <end>,puis je emprunter votre dictionnaire ? 
 <start> tom didn t know who mary was planning to marry . <end>, <start> tom ne savait pas avec qui marie envisageait de se marier . <end>,tom ne savait pas qui marie a prevoyait de se marier . 
 <start> i promise you i ll keep you safe . <end>, <start> je vous promets que je vous garderai en securite . <end>,je vous promets de vous garder en securite . 
 <start> she kicked him . <end>, <start> elle lui donna un coup de pied . <end>,elle l a frappe . 
 <start> i don t even like fish . <end>," <start> meme le poisson , je ne l aime pas . <end>",je n aime meme pas le poisson . 
 <start> i think it s reliable . <end>, <start> je pense que c est fiable . <end>,je pense que c est fiable . 
 <start> we re not desperate yet . <end>, <start> nous ne sommes pas encore desesperes . <end>,nous ne sommes pas encore desesperes . 
 <start> make it quick . <end>, <start> fais vite ! <end>,faites vite ! 
 <start> it s my duty to help you . <end>, <start> c est mon devoir de t aider . <end>,c est mon devoir de t aider . 
 <start> the house is not occupied now . <end>, <start> la maison est actuellement inoccupee . <end>,la maison est actuellement inoccupee . 
 <start> do you want to go fishing tomorrow ? <end>," <start> voulez vous aller pecher , demain ? <end>","voulez vous aller pecher , demain ? "
 <start> i m sure you have other skills . <end>, <start> je suis sure que vous avez d autres competences . <end>,je suis sure d avoir d autres competences . 
 <start> are you sure of it ? <end>, <start> en etes vous surs ? <end>,en es tu sure ? 
 <start> could i make a reservation ? <end>, <start> pourrais je faire une reservation ? <end>,puis je faire une reservation ? 
 <start> thank you ever so much . <end>, <start> grand merci . <end>,merci beaucoup . 
 <start> please help yourself . <end>, <start> servez vous s il vous plait . <end>,"je vous en prie , servez vous . "
 <start> tom peeked inside . <end>, <start> tom jeta un il a l interieur . <end>,tom jeta un coup d il a l interieur . 
 <start> this book is about stars . <end>, <start> ce livre parle des etoiles . <end>,ce livre est sur des etoiles . 
 <start> which program did you watch yesterday ? <end>, <start> quelle emission as tu regardee hier ? <end>,quelle emission avez vous regardee hier ? 
 <start> what is the book about ? <end>, <start> de quoi parle le livre ? <end>,qu est ce livre ? 
 <start> what do you call your mother ? <end>, <start> comment appelles tu ta mere ? <end>,comment appelles tu ta mere ? 
 <start> is this appropriate ? <end>, <start> est ce convenable ? <end>,est ce approprie ? 
 <start> pray for all of us . <end>, <start> priez pour nous tous ! <end>,priez pour nous tous ! 
 <start> it s thirty degrees below zero . <end>, <start> il fait moins trente . <end>,il fait trente zero . 
 <start> i had something planned . <end>, <start> j ai prevu quelque chose . <end>,j ai prevu quelque chose . 
 <start> i don t like your suggestion . <end>, <start> je n apprecie pas ta suggestion . <end>,je n aime pas votre suggestion . 
 <start> what a pleasant surprise ! <end>, <start> quelle agreable surprise ! <end>,quelle agreable surprise ! 
 <start> he reminded his wife to wake him up at a . m . <end>, <start> il a rappele a sa femme de le reveiller a heures du matin . <end>,il se cassa sa femme de l apprehender a elle . 
 <start> tom looks sad . <end>, <start> tom a l air triste . <end>,tom a l air triste . 
 <start> my bike is not anything like yours . <end>, <start> mon velo n a rien a voir avec le votre . <end>,mon velo n est rien a la tienne . 
 <start> i didn t want to intrude . <end>, <start> je ne voulais pas m imposer . <end>,je ne voulais pas m imposer . 
 <start> three were wounded . <end>, <start> trois furent blesses . <end>,trois ont ete blessees . 
" <start> i understand the sentence , but i m not able to translate it . <end>", <start> je comprends la phrase mais je ne suis pas en mesure de la traduire . <end>,je comprends la phrase mais je ne suis pas en mesure de traduire . 
 <start> i m looking for my watch . <end>, <start> je suis a la recherche de ma montre . <end>,je cherche ma montre . 
 <start> i really wish i could be there with you . <end>," <start> je souhaiterais vraiment pouvoir etre la , avec toi . <end>",j espere vraiment pouvoir etre la avec toi . 
 <start> tom had never seen mary that angry . <end>, <start> tom n avait jamais vu marie autant en colere . <end>,tom n avait jamais vu mary autant en colere . 
 <start> let s replace all of them . <end>, <start> remplacons les tous . <end>,remplacons les tous . 
 <start> you re not looking at the whole picture . <end>, <start> vous ne regardez pas l ensemble du tableau . <end>,tu ne regardes pas l ensemble du tableau . 
 <start> i really miss my girlfriend . <end>, <start> ma petite amie me manque vraiment . <end>,ma petite amie me manque vraiment . 
 <start> they shouldn t be doing that . <end>, <start> elles ne devraient pas faire cela . <end>,ils ne devraient pas faire ca . 
 <start> she decided to have the operation . <end>, <start> elle se decida a subir l operation . <end>,elle a decide de subir l operation . 
 <start> he says it s urgent . <end>, <start> il dit que c est urgent . <end>,il dit que c est urgent . 
 <start> i need you right now . <end>, <start> j ai immediatement besoin de toi . <end>,j ai immediatement besoin de vous . 
 <start> look up words you don t know in your dictionary . <end>, <start> cherchez les mots que vous ne connaissez pas dans votre dictionnaire . <end>,cherche les paroles que tu ne connais pas dans ton dictionnaire . 
 <start> he missed the train by one minute . <end>, <start> il a manque le train d une minute . <end>,il a manque son train d une minute . 
 <start> i noticed that i had grown up when i started following my parents advice . <end>, <start> j ai remarque que j avais grandi lorsque j ai commence a suivre les conseils de mes parents . <end>,j ai remarque que je disposais de pantalon lorsque j ai allume ma parole des parents . 
 <start> what did you call me ? <end>, <start> comment m as tu appelee ? <end>,comment m avez vous appele ? 
 <start> i understand your problem . <end>, <start> je comprends ton probleme . <end>,je comprends ton probleme . 
 <start> i pay most of my bills on the first of each month . <end>, <start> je paie la plupart de mes factures au premier du mois . <end>,je paie la plupart de mes factures sur le premier du mois . 
 <start> bacteria will not breed in alcohol . <end>, <start> les bacteries ne se reproduisent pas dans l alcool . <end>,les bacteries ne se reproduisent pas en alcool . 
 <start> i feel empowered . <end>, <start> je me sens investi de pouvoirs . <end>,je me sens investie de pouvoir . 
 <start> he departed for london the day before yesterday . <end>, <start> il partit pour londres avant hier . <end>,il est parti pour londres avant hier . 
 <start> good luck with that . <end>, <start> bonne chance avec ca ! <end>,bonne chance avec ca . 
 <start> tom often walks to school . <end>, <start> tom va souvent a l ecole en marchant . <end>,tom va souvent a l ecole a pied . 
 <start> tom should ve told us about this . <end>, <start> tom aurait du nous le dire . <end>,tom aurait du nous en parler . 
