Phrase_a_traduire,Phrase_traduite,Sortie_modele
 <start> you should not despise a man because he is poor . <end>, <start> tu ne devrais pas mepriser un homme parce qu il est pauvre . <end>,tu ne devrais pas mepriser un homme parce qu il est pauvre . 
 <start> they will debate the question tomorrow . <end>, <start> elles discuteront de la question demain . <end>,ils discuteront de la question demain . 
 <start> tom solved the mystery . <end>, <start> tom a resolu le mystere . <end>,tom a resolu le mystere . 
 <start> i had no idea what to expect . <end>, <start> je n avais aucune idee a quoi m attendre . <end>,je n avais aucune idee a quoi m attendre . 
 <start> candles were everywhere . <end>, <start> il y avait des bougies partout . <end>,les coups etaient partout . 
 <start> catch tom . <end>, <start> attrapez tom . <end>,attrape tom . 
" <start> obviously , tom didn t want to go . <end>"," <start> visiblement , tom ne voulait pas y aller . <end>","a l evidence , tom ne voulait pas y aller . "
 <start> i called them . <end>, <start> je les ai appelees . <end>,je les ai soudoyes . 
 <start> try to calm down . <end>, <start> essayez de vous calmer ! <end>,essayez de vous calmer ! 
 <start> i work for mcdonald s . <end>, <start> je travaille chez mcdonald s . <end>,je travaille chez mcdonald s . 
 <start> tom is eating breakfast right now . <end>, <start> tom est en train de manger son petit dejeuner en ce moment . <end>,tom est en train de prendre son petit dejeuner pour le moment . 
" <start> you may stay here if you like , as long as you keep quiet . <end>"," <start> vous pouvez rester ici si vous voulez , aussi longtemps que vous restez tranquille . <end>","vous pouvez rester ici si vous voulez , aussi longtemps que vous restez tranquilles . "
 <start> this is the largest temple that i ve ever seen . <end>, <start> c est le plus grand temple que j ai jamais vu . <end>,c est le plus grand temple que j ai jamais vu . 
 <start> i exaggerated . <end>, <start> j ai exagere . <end>,j ai exagere . 
 <start> we may as well start at once . <end>, <start> on pourrait aussi commencer de suite . <end>,il se peut que nous parlions tout de suite . 
 <start> you re my boss . <end>, <start> tu es mon patron . <end>,tu es mon chef . 
 <start> don t you want to know where i was ? <end>, <start> ne voulez vous pas savoir ou j etais ? <end>,ne veux tu pas savoir ou j etais ? 
 <start> this book isn t as heavy as that book . <end>, <start> ce livre ci n est pas aussi lourd que ce livre la . <end>,ce livre ci n est pas aussi lourd que ce livre . 
 <start> something s wrong here . <end>, <start> quelque chose ne va pas ici . <end>,quelque chose cloche ici ! 
 <start> this band is really good . <end>, <start> ce groupe est vraiment bon . <end>,ce groupe est vraiment bon . 
 <start> i know this is hard for you to understand . <end>," <start> je sais que c est difficile a comprendre , pour vous . <end>",je sais que c est dur de comprendre . 
 <start> he glanced at her and saw she was angry . <end>, <start> il lui jeta un regard et vit qu elle etait en colere . <end>,il lui jeta un regard et vit qu elle etait en colere . 
 <start> the shop was busy . <end>, <start> le magasin etait plein de monde . <end>,le magasin etait occupe . 
 <start> math and english were my favorite subjects . <end>, <start> les maths et l anglais etaient mes matieres preferees . <end>,l eau et l anglais etaient ma crainte . 
 <start> these are difficult questions . <end>, <start> ce sont des questions difficiles . <end>,ce sont des questions difficiles . 
 <start> i slept with my clothes on . <end>, <start> j ai dormi avec mes vetements sur moi . <end>,j ai dormi avec mes habits . 
 <start> i wonder if anything happened to him . <end>, <start> je me demande si quoi que ce soit lui est arrive . <end>,je me demande si quoi que ce soit lui est arrive . 
 <start> mom and dad are very nervous . <end>, <start> maman et papa sont tres nerveux . <end>,maman et papa sont tres nerveux . 
 <start> we re no longer working for tom . <end>, <start> nous ne travaillons plus pour tom . <end>,nous ne travaillons plus pour tom . 
 <start> do you find that washing machine easy to use ? <end>, <start> trouves tu cette machine a laver facile a utiliser ? <end>,trouvez vous cette machine a laver facile a utiliser ? 
 <start> we should try doing this another way . <end>, <start> nous devrions essayer de faire ceci d une autre maniere . <end>,nous devrions essayer de faire ca une autre facon . 
" <start> women are meant to be loved , not to be understood . <end>"," <start> les femmes sont censees etre aimees , pas comprises . <end>","les femmes sont censees etre aimees , pas comprises . "
 <start> she s a lot smarter than she looks . <end>, <start> elle est bien plus intelligente qu elle ne parait . <end>,c est bien plus intelligent qu elle ne l regarde . 
 <start> that s the one thing i m sure of . <end>, <start> c est l unique chose dont je sois certain . <end>,c est une seule chose que je sois sure . 
 <start> i think that s exciting . <end>, <start> je pense que c est excitant . <end>,je pense que c est grisant . 
 <start> i ve only seen it once . <end>, <start> je ne l ai vu qu une fois . <end>,je ne l ai vu qu une fois . 
 <start> there is an urgent need for a new policy . <end>, <start> on a un besoin urgent d une nouvelle politique . <end>,il y a un besoin urgent d une nouvelle politique . 
 <start> i was just trying to be helpful . <end>, <start> j essayais juste d aider . <end>,j essayais juste d essayer . 
 <start> what re you doing today ? <end>, <start> que faites vous aujourd hui ? <end>,qu es tu en train de faire aujourd hui ? 
 <start> tom s book was translated into french . <end>, <start> le livre de tom a ete traduit en francais . <end>,le livre de tom a ete traduit en francais . 
 <start> where did you go ? <end>, <start> ou es tu alle ? <end>,ou etes vous alle ? 
 <start> she didn t have a brother . <end>, <start> elle n avait pas de frere . <end>,elle n avait pas de frere . 
 <start> be merciful . <end>, <start> sois clement ! <end>,soyez misericordieuses ! 
 <start> you didn t keep your word . <end>, <start> vous n avez pas tenu votre parole . <end>,vous n avez pas tenu votre parole . 
 <start> i wonder if you ever think of me . <end>, <start> je me demande si vous pensez jamais a moi . <end>,je me demande si vous pensez jamais a moi . 
 <start> thank you all so much . <end>," <start> merci a tous , tellement . <end>",merci bien tous . 
" <start> i just think you should be more careful , that s all . <end>"," <start> je pense simplement que vous devriez etre plus prudent , c est tout . <end>","je pense simplement que tu devrais etre plus prudente , c est tout . "
 <start> how tall you are ! <end>, <start> comme tu es grande ! <end>,comme tu es grand ! 
 <start> tom has the necessary experience . <end>, <start> tom a l experience necessaire . <end>,tom a l experience necessaire . 
 <start> i don t remember anything happening . <end>, <start> je ne me rappelle pas que quoi que ce fut arriva . <end>,je ne me rappelle pas que quoi que ce soit se soit produit . 
 <start> he fed his dog at the same time every day . <end>, <start> il a nourri son chien a la meme heure chaque jour . <end>,il nourrissait son chien a la meme heure chaque jour . 
 <start> the bus was empty except for one elderly woman . <end>," <start> le bus etait vide , a l exception d une vieille dame . <end>",le bus etait vide en tant d une vieille dame . 
 <start> i don t know what else we should do . <end>, <start> je ne sais pas ce que nous devrions faire d autre . <end>,je ne sais pas quoi nous devrions faire d autre . 
" <start> you want to get out of here , don t you ? <end>"," <start> tu veux sortir d ici , n est ce pas ? <end>","tu veux sortir d ici , n est ce pas ? "
 <start> i will wait outside . <end>, <start> j attendrai a l exterieur . <end>,j attendrai dehors . 
 <start> you re preaching to the choir . <end>, <start> tu preches un convaincu . <end>,vous prechez des convaincus . 
 <start> i could not afford to buy a bicycle . <end>, <start> je n ai pas les moyens de m acheter un velo . <end>,je ne pouvais pas me permettre d acheter un velo . 
 <start> is everybody happy now ? <end>, <start> est ce que tout le monde est heureux maintenant ? <end>,tout le monde est il heureux maintenant ? 
 <start> may i use your phone ? <end>, <start> puis je utiliser ton telephone ? <end>,puis je utiliser votre telephone ? 
 <start> they did the right thing . <end>, <start> elles ont fait ce qu il fallait . <end>,ils ont fait ce qu il fallait faire . 
 <start> i want another beer . <end>, <start> je veux une autre biere . <end>,je veux une autre biere . 
 <start> i get depressed at times . <end>," <start> parfois , je deprime . <end>",je deprime des femmes . 
" <start> the more , the better . <end>", <start> le plus sera le mieux . <end>,plus le meilleur . 
 <start> tom always tries to do what he thinks is right . <end>, <start> tom essaye toujours de faire ce qu il pense etre juste . <end>,tom essaye toujours de faire ce qu il pense est juste . 
 <start> i have to study for tomorrow s french test . <end>, <start> je dois etudier pour le controle de francais de demain . <end>,il me faut etudier pour le controle de francais de demain . 
 <start> is there anyone here ? <end>, <start> quiconque est il ici ? <end>,y a t il qui que ce soit ici ? 
 <start> why don t you want to come with us ? <end>, <start> pourquoi ne veux tu pas venir avec nous ? <end>,pourquoi ne veux tu pas venir avec nous ? 
 <start> i think you should lose some weight . <end>, <start> je pense que vous devriez perdre du poids . <end>,je pense que vous devriez perdre du poids . 
 <start> i don t have the time for this . <end>, <start> je n ai pas le temps pour ca . <end>,je n ai pas le temps pour ca . 
 <start> i just don t want you making any mistakes . <end>, <start> je ne veux tout simplement pas que tu commettes d erreurs . <end>,je ne veux tout simplement pas que tu commettes d erreurs . 
 <start> tom died when he was . <end>, <start> tom est mort a l age de quatre vingt dix sept ans . <end>,tom est mort quand il etait . 
 <start> be nicer to your sister . <end>, <start> sois plus gentil avec ta s ur . <end>,soyez plus gentil avec votre s ur . 
 <start> nobody has a landline these days . <end>, <start> plus personne n a de telephone fixe de nos jours . <end>,personne n a de telephone fixe de nos jours . 
 <start> how do you stand this cold ? <end>, <start> comment supportes tu ce froid ? <end>,comment supportez vous ce froid ? 
 <start> they came up with a plan after a long discussion . <end>, <start> ils ont imagine un plan apres une longue discussion . <end>,ils ont imagine un plan apres une longue discussion . 
 <start> how many audiobooks do you have on your mobile mp player ? <end>, <start> combien de livres enregistres as tu sur ton baladeur numerique ? <end>,combien de livres audio as tu sur ton baladeur numerique ? 
 <start> why would you want to be a teacher ? <end>, <start> pourquoi voudrais tu etre enseignant ? <end>,pourquoi voudrais tu etre enseignante ? 
 <start> you say you don t want to get your hands dirty . <end>, <start> tu dis que tu ne veux pas te salir les mains . <end>,tu dis que tu ne veux pas avoir tes mains sales . 
 <start> she advised him to come back at once . <end>, <start> elle lui a conseille de revenir tout de suite . <end>,elle lui conseilla de revenir tout de suite . 
 <start> i ll handle everything . <end>, <start> je gererai tout . <end>,je gererai tout . 
 <start> how many books do you think you have read so far ? <end>, <start> combien de livres penses tu avoir lu jusqu a maintenant ? <end>,combien de livres penses tu avoir lu jusqu a disponible ? 
 <start> where are you going this afternoon ? <end>, <start> ou allez vous vous rendre cet apres midi ? <end>,ou vas tu cet apres midi ? 
 <start> stop talking about tom . <end>, <start> arrete de parler de tom . <end>,arrete de parler de tom . 
 <start> they sat in the shade of that big tree . <end>, <start> ils se sont assis a l ombre de ce grand arbre . <end>,ils s assirent a l ombre de ce grand arbre . 
 <start> this is no time to be funny . <end>, <start> l heure n est pas a l amusement . <end>,ca n est pas du temps d etre marrant . 
 <start> i was at home . <end>, <start> j etais a la maison . <end>,j etais chez moi . 
 <start> tom did something wrong . <end>, <start> tom a fait quelque chose de mal . <end>,tom a fait quelque chose de travers . 
 <start> i thought you might like some company . <end>, <start> j ai pense que tu apprecierais peut etre de la compagnie . <end>,je pensais que tu apprecierais peut etre de la compagnie . 
 <start> we were rowing against the current . <end>, <start> nous ramions a contre courant . <end>,nous nous sommes destines contre le lieu de residence . 
 <start> i don t regret what happened last night . <end>, <start> je ne regrette pas ce qui s est passe la nuit derniere . <end>,je ne regrette pas ce qui est arrive hier au soir . 
 <start> be careful ! <end>, <start> faites attention ! <end>,soyez prudente ! 
 <start> do you know where tokyo tower is ? <end>, <start> savez vous ou se trouve la tour de tokyo ? <end>,savez vous ou se trouve la tour de tokyo ? 
" <start> do you want this room painted , too ? <end>", <start> veux tu que cette piece soit egalement peinte ? <end>,veux tu que cette piece soit egalement peinte ? 
 <start> tom doesn t like singing . <end>, <start> tom n aime pas chanter . <end>,tom n aime pas chanter . 
 <start> you might be correct . <end>, <start> il se pourrait que tu aies raison . <end>,il se pourrait que vous ayez raison . 
 <start> i think you re right . <end>, <start> je pense que tu as raison . <end>,je pense que tu as raison . 
 <start> did you go straight home after school yesterday ? <end>," <start> etes vous directement rentrees chez vous hier , apres l ecole ? <end>","etes vous directement rentre chez vous hier , apres l ecole ? "
 <start> i spoke loudly so that everyone could hear me . <end>," <start> je parlai fort , de maniere a ce que chacun puisse m entendre . <end>",j ai parle tres fort pour que chacun puisse m entendre . 
 <start> please remember what he said . <end>, <start> veuillez vous rappeler ce qu il a dit . <end>,"rappelle toi ce qu il a dit , s il vous plait . "
 <start> don t get angry . it won t help you . <end>, <start> ne te fache pas . ca ne va pas t aider . <end>,ne vous mettez pas en colere . ca ne vous aidera pas . 
 <start> i m irreplaceable . <end>, <start> je suis irremplacable . <end>,je suis irremplacable . 
 <start> i can t leave now . <end>, <start> je ne peux pas partir maintenant . <end>,je ne peux pas partir maintenant . 
 <start> reading is one of life s great pleasures . <end>, <start> la lecture est l un des grands plaisirs de la vie . <end>,la lecture est d une vie de vie . 
 <start> you don t have to go . <end>, <start> vous n etes pas forcees d y aller . <end>,vous n etes pas oblige de vous en aller . 
 <start> i m very pleased to meet you . <end>, <start> je suis ravi de faire votre connaissance . <end>,je suis tres heureux de vous rencontrer . 
 <start> it serves our purpose . <end>, <start> ca sert notre objectif . <end>,ca sert notre objectif . 
 <start> i thought you were going to stay home . <end>, <start> j ai pense que vous alliez rester chez vous . <end>,je pensais que vous alliez rester chez vous . 
" <start> sit down , tom . <end>"," <start> assieds toi , tom . <end>","assieds toi , tom . "
 <start> do you know anyone who needs a job ? <end>, <start> connais tu quelqu un qui a besoin d un travail ? <end>,connaissez vous qui que ce soit qui a besoin d un travail ? 
 <start> let s not squabble . <end>, <start> ne nous chamaillons pas ! <end>,ne nous chamaillons pas ! 
 <start> don t blame me for your mistakes . <end>, <start> ne me reprochez pas vos erreurs . <end>,ne me blame pas pour tes erreurs . 
 <start> tom is working as a security guard . <end>, <start> tom travaille comme agent de securite . <end>,tom travaille comme agent de securite . 
 <start> i sometimes take a shower in the morning . <end>, <start> je prends parfois une douche le matin . <end>,je prends parfois une douche le matin . 
 <start> would you come here a moment ? <end>, <start> pourriez vous venir ici un instant ? <end>,viendriez vous ici un moment ? 
 <start> why would anybody want to do that ? <end>, <start> pourquoi quiconque voudrait il faire cela ? <end>,pourquoi quiconque voudrait faire ca ? 
 <start> he faced toward the sea . <end>, <start> il faisait face a la mer . <end>,il faisait face a la mer . 
 <start> are you sure there s nothing else to drink ? <end>, <start> etes vous sures qu il n y a rien d autre a boire ? <end>,es tu sure qu il n y a rien d autre a boire ? 
 <start> i want to be pampered . <end>, <start> je veux qu on me choie . <end>,je veux qu on me choie . 
 <start> don t you remember what you said ? <end>, <start> ne vous souvenez vous pas de ce que vous avez dit ? <end>,ne vous souvenez vous pas de ce que vous avez dit ? 
" <start> i hate to run the risk , but i have no choice . <end>", <start> je deteste en courir le risque mais je n ai pas le choix . <end>,je deteste etre sur le risque mais je n ai pas le choix . 
 <start> i live in boston . <end>, <start> je vis a boston . <end>,je vis a boston . 
 <start> she said she had been happy . <end>, <start> elle a dit qu elle avait ete heureuse . <end>,elle a dit qu elle avait ete heureuse . 
 <start> what s the weather like where you are ? <end>," <start> comment est le temps , la ou vous vous trouvez ? <end>",qu est le temps qu on est ? 
 <start> who s that boy swimming over there ? <end>, <start> qui est ce garcon qui nage la bas ? <end>,qui est ce garcon qui nage la bas ? 
 <start> no one ate the cake . <end>, <start> personne ne mangea le gateau . <end>,personne n a mange le gateau . 
 <start> i knew i d be blamed . <end>, <start> je savais qu on me le reprocherait . <end>,je savais que je serais contre . 
 <start> you can rely on him . <end>, <start> tu peux te fier a lui . <end>,tu peux te fier a lui . 
 <start> do you think our team will win ? <end>, <start> pensez vous que notre equipe va gagner ? <end>,penses tu notre equipe ? 
 <start> i admit i wasn t sure . <end>, <start> j admets que je n etais pas sur . <end>,j admets que je n etais pas sure . 
 <start> they forgot to wake me up . <end>, <start> elles ont oublie de me reveiller . <end>,ils ont oublie de me reveiller . 
 <start> you re early . <end>, <start> tu es en avance . <end>,tu es matinale . 
 <start> what do you think about this outfit ? <end>, <start> que penses tu de cette tenue ? <end>,que penses tu de cette tenue ? 
 <start> did you enjoy yourself yesterday ? <end>," <start> t es tu bien amusee , hier ? <end>","t es tu amuse , hier ? "
 <start> we ll start whenever you are ready . <end>, <start> nous commencerons des que vous etes pret . <end>,nous commencerons que tu seras pret . 
 <start> she took advantage of the fine weather to paint the wall . <end>, <start> elle profita du beau temps pour peindre le mur . <end>,elle a profite du beau temps pour peindre le mur . 
 <start> have you finished reading the novel ? <end>, <start> avez vous termine de lire le roman ? <end>,avez vous termine de lire le roman ? 
 <start> that s so weird . <end>, <start> c est tellement bizarre . <end>,c est tellement bizarre . 
 <start> he s not always at home on sundays . <end>, <start> il n est pas toujours chez lui le dimanche . <end>,il n est pas toujours a la maison le dimanche . 
 <start> make sure you turn everything off before you leave . <end>, <start> assurez vous d avoir tout eteint avant de partir . <end>,assurez vous d avoir tout de suite avant de partir . 
" <start> in american football , a touchdown scores six points . <end>", <start> en football americain un touche vaut six points . <end>,en football americain un touche vaut six points . 
 <start> i have to change clothes . <end>, <start> je dois changer de vetements . <end>,il me faut changer de vetements . 
 <start> he made a will last year . <end>, <start> il a fait un testament l annee derniere . <end>,il a fait un testament l annee derniere . 
 <start> she takes everything for granted . <end>, <start> elle prend tout pour argent comptant . <end>,elle prend tout pour acquis . 
 <start> i like to take things apart to see what makes them tick . <end>, <start> j aime demonter les choses pour voir comment elles fonctionnent . <end>,j aime demonter les choses a voir comment elles fonctionnent . 
 <start> nobody knows his name . <end>, <start> personne ne connait son nom . <end>,personne ne connait son nom . 
 <start> he admitted that he wanted to escape from here . <end>, <start> il a reconnu qu il etait impatient de s enfuir d ici . <end>,il a admis qu il voulait echapper a la . 
 <start> what will that achieve ? <end>, <start> qu est ce que ca produira ? <end>,qu est ce que ca produira ? 
 <start> i don t want to eat lunch now . <end>, <start> je ne veux pas dejeuner maintenant . <end>,je ne veux pas diner maintenant . 
 <start> she started for kyoto yesterday . <end>, <start> elle est partie hier pour kyoto . <end>,elle se mit a kyoto hier . 
 <start> i apologize for the delay in replying . <end>, <start> je presente mes excuses pour le delai de reponse . <end>,je m excuse pour le delai de reponse . 
 <start> how good are you ? <end>, <start> jusqu a quel point etes vous bons ? <end>,jusqu a quel point etes vous ? 
 <start> what s your favorite racing game ? <end>, <start> quel est ton jeu de course prefere ? <end>,quel est ton jeu prefere ? 
 <start> i wouldn t bet on that if i were you . <end>, <start> je ne parierais pas sur ca si j etais toi . <end>,je ne parierais pas la si j etais toi . 
 <start> we need to get going . <end>, <start> il nous faut demarrer . <end>,nous avons besoin de nous en aller . 
 <start> i was studying english when you called yesterday . <end>, <start> j etais en train d etudier mon anglais lorsque vous avez appele hier . <end>,j etais en train d etudier l anglais lorsque vous etes appele hier . 
 <start> these shoes are a little loose . <end>, <start> ces chaussures sont un peu grandes . <end>,ces chaussures sont un peu . 
 <start> does tom like to swim ? <end>, <start> tom aime t il nager ? <end>,est ce que tom aime nager ? 
 <start> can i think about it ? <end>, <start> puis je y reflechir ? <end>,puis je y reflechir ? 
 <start> i have your schedule here . <end>, <start> je dispose ici de ton programme . <end>,je dispose ici de votre programme . 
 <start> would you like to have some tea ? <end>, <start> voudriez vous un peu de the ? <end>,voudrais tu du the ? 
 <start> which of you will try it first ? <end>, <start> lequel d entre vous va l essayer en premier ? <end>,lequel d entre vous va essayer le premier ? 
 <start> who doesn t think so ? <end>, <start> qui ne pense pas de meme ? <end>,qui ne pense pas ca ? 
 <start> we have business to discuss . <end>, <start> nous devons discuter . <end>,nous avons des affaires a discuter . 
 <start> can you imagine him driving such a splendid car ? <end>, <start> pouvez vous l imaginer conduire une si belle voiture ? <end>,peux tu l imaginer conduire une voiture de voiture geologique ? 
 <start> he remained dumb . <end>, <start> il est reste silencieux . <end>,il est reste silencieux . 
 <start> do you want to be left out ? <end>, <start> veux tu qu on te laisse en dehors de ca ? <end>,voulez vous qu on vous quittait ? 
 <start> there are certainly some points worth considering . <end>, <start> il y a certainement quelques points qui meritent reflexion . <end>,il y a beaucoup de points qui merite sans dire . 
 <start> tom asked mary if she would be willing to donate some money . <end>, <start> tom demanda a mary si elle etait d accord pour donner de l argent . <end>,tom a demande a mary si elle serait dispose de faire un peu d argent . 
 <start> how does that strike you ? <end>," <start> qu est ce qui te frappe , la dedans ? <end>",comment cela vous frappe t il la dedans ? 
 <start> the girls are going to be late this evening . <end>, <start> les filles vont etre en retard ce soir . <end>,les filles vont etre en retard ce soir . 
 <start> tom hopes that mary will come next weekend . <end>, <start> tom espere que marie viendra le weekend prochain . <end>,tom espere que mary viendra le weekend prochain . 
 <start> i want to apologize for the way i talked to you the last time we met . <end>, <start> je veux presenter mes excuses pour la maniere dont je t ai parle la derniere fois que nous nous sommes rencontrees . <end>,je veux presenter mes excuses pour la maniere dont je vous ai parle la derniere fois que nous nous sommes rencontres . 
 <start> i m still your friend . <end>, <start> je suis toujours ton amie . <end>,je suis toujours votre amie . 
 <start> our stay has been very pleasant . <end>, <start> notre sejour a ete tres agreable . <end>,notre sejour a ete tres agreable . 
 <start> why are they so upset ? <end>, <start> pourquoi sont elles si enervees ? <end>,pourquoi sont elles si enervees ? 
 <start> i have everything . <end>, <start> j ai tout . <end>,j ai tout . 
 <start> i ll have to catch the train to paris . <end>, <start> je dois prendre le train de h pour paris . <end>,il me faudra prendre le train de paris pour paris . 
 <start> his opinion was the same as mine . <end>, <start> son opinion etait la meme que la mienne . <end>,son opinion etait la meme chose que la mienne . 
 <start> i was probably wrong . <end>, <start> j avais probablement tort . <end>,j avais probablement tort . 
 <start> he didn t get in until o clock in the morning . <end>, <start> il n a pas pu arriver avant heures du matin . <end>,il ne descendit pas avant heures du matin . 
 <start> you re articulate . <end>, <start> vous vous exprimez bien . <end>,tu t exprimes bien . 
